published_year,num_pages,book_Title,Book_Author,year_of_Publication,image,categoryname,price,inStock,category,description
2007,126,the first four years,Laura Ingalls Wilder,2007,http://books.google.com/books/content?id=_HqHxm0kuIUC&printsec=frontcover&img=1&zoom=1&source=gbs_api,fiction,2,27,,"During their first four years of marriage, Laura and Almanzo Wilder have a child and fight a losing battle in their attempts to succeed at farming on the South Dakota prairie. Reissue."
2006,192,the alchemist - gift edition,Paulo Coelho,2006,http://books.google.com/books/content?id=h6QuJZffgHYC&printsec=frontcover&img=1&zoom=1&source=gbs_api,fiction,14,30,,"""My heart is afraid that it will have to suffer,"" the boy told the alchemist one night as they looked up at the moonless sky."" Tell your heart that the fear of suffering is worse than the suffering itself. And that no heart has ever suffered when it goes in search of its dreams."" Every few decades a book is published that changes the lives of its readers forever. The Alchemist is such a book. With over a million and a half copies sold around the world, The Alchemist has already established itself as a modern classic, universally admired. Paulo Coelho's charming fable, now available in English for the first time, will enchant and inspire an even wider audience of readers for generations to come. The Alchemist is the magical story of Santiago, an Andalusian shepherd boy who yearns to travel in search of a worldly treasure as extravagant as any ever found. From his home in Spain he journeys to the markets of Tangiers and across the Egyptian desert to a fateful encounter with the alchemist. The story of the treasures Santiago finds along the way teaches us, as only a few stories have done, about the essential wisdom of listening to our hearts, learning to read the omens strewn along life's path, and, above all, following our dreams."
2006,304,pretty things,Liz Goldwyn,2006,http://books.google.com/books/content?id=2NhyQgAACAAJ&printsec=frontcover&img=1&zoom=1&source=gbs_api,biography & autobiography,4,30,,"Liz Goldwyn's lifelong fascination with the inimitable glamour of classic burlesque inspired her to spend the past eight years corresponding with, visiting, interviewing, receiving striptease lessons from, and forming close relationships with the last generation of the great American burlesque queeens. Goldwyn invites us to step back into an era when the hourglass figure was in vogue and striptease was a true art form. Meet Betty ""Ball of Fire"" Rowland, who was known for her flaming red hair and bump–and–grind routines. (It turns out she once sued the author's grandfather, Samuel Goldwyn Jr., for using her stage name and costume in his Hollywood picture, Ball of Fire.) Meet Sherry Britton, who, with her long black hair and curvy, trim physique, was among the most stunning of the burlesque stars before Mayor LaGuardia outlawed burlesque in New York. Meet Zorita, whose sexually explicit ""Consummation of the Wedding of the Snake"" dance (performed with a live snake) and other daring performances earned her legendary status. Goldwyn draws back the curtain to reveal the personal journeys of yesteryear's icons of female sexuality and power, restoring their legacy to an age that has all but forgotten them–despite today's resurgence of burlesque."
2006,304,eaters of the dead,Michael Crichton,2006,http://books.google.com/books/content?id=o2yu6uJF2SoC&printsec=frontcover&img=1&zoom=1&source=gbs_api,fiction,1,29,,"An ambassador of the tenth-century Caliph of Bagdad is carried off by the Norsemen to endure, for three years, the harshness of their way of life and the creatures that terrorize them."
2006,344,genome,Matt Ridley,2006,http://books.google.com/books/content?id=h2zcDWshkEkC&printsec=frontcover&img=1&zoom=1&source=gbs_api,science,9,23,,"The genome's been mapped. But what does it mean? Arguably the most significant scientific discovery of the new century, the mapping of the twenty-three pairs of chromosomes that make up the human genome raises almost as many questions as it answers. Questions that will profoundly impact the way we think about disease, about longevity, and about free will. Questions that will affect the rest of your life. Genome offers extraordinary insight into the ramifications of this incredible breakthrough. By picking one newly discovered gene from each pair of chromosomes and telling its story, Matt Ridley recounts the history of our species and its ancestors from the dawn of life to the brink of future medicine. From Huntington's disease to cancer, from the applications of gene therapy to the horrors of eugenics, Matt Ridley probes the scientific, philosophical, and moral issues arising as a result of the mapping of the genome. It will help you understand what this scientific milestone means for you, for your children, and for humankind."
2006,336,the zero,Jess Walter,2006,http://books.google.com/books/content?id=x5JrBQ4bfLsC&printsec=frontcover&img=1&zoom=1&source=gbs_api,fiction,11,30,,"Five days after a terrorist attack decimates his home city, Brian Remy struggles with gaps in his memory pertaining to a self-inflicted gunshot wound, a girlfriend whose name he does not know, and deteriorating eyesight, a situation that is further challenged when he is recruited to gather information for a shadowy intelligence operation. 100,000 first printing."
2007,312,kitchen confidential updated ed,Anthony Bourdain,2007,http://books.google.com/books/content?id=bxLbZ2kGddIC&printsec=frontcover&img=1&zoom=1&source=gbs_api,biography & autobiography,11,26,,"A deliciously funny, delectably shocking banquet of wild-but-true tales of life in the culinary trade from Chef Anthony Bourdain, laying out his more than a quarter-century of drugs, sex, and haute cuisine—now with all-new, never-before-published material"
1979,256,dream & the underwor,James Hillman,1979,http://books.google.com/books/content?id=-vMpuwPRVFsC&printsec=frontcover&img=1&zoom=1&source=gbs_api,psychology,11,27,,"In a deepening of the thinking begun in The Myth of Analysis and Re-Visioning Psychology, James Hillman develops the first new view of dreams since Freud and Jung."
1966,152,the crying of lot 49,Thomas Pynchon,1966,http://books.google.com/books/content?id=njOBt0OWKOQC&printsec=frontcover&img=1&zoom=1&source=gbs_api,fiction,7,21,,"The highly original satire about Oedipa Maas, a woman who finds herself enmeshed in a worldwide conspiracy, meets some extremely interesting characters, and attains a not inconsiderable amount of self knowledge."
1988,255,an american childhood,Annie Dillard,1988,http://books.google.com/books/content?id=tRihTvnOM-gC&printsec=frontcover&img=1&zoom=1&source=gbs_api,biography & autobiography,14,22,,"A book that instantly captured the hearts of readers across the country, An American Childhood is Pulitzer Prize-winning author Annie Dillard's poignant, vivid memoir of growing up in Pittsburgh in the 1950s."
1988,177,teaching a stone to talk,Annie Dillard,1988,http://books.google.com/books/content?id=pY5llwEACAAJ&printsec=frontcover&img=1&zoom=1&source=gbs_api,literary criticism,12,23,,"Here, in this compelling assembly of writings, Pulitzer Prize-winning author Annie Dillard explores the world of natural facts and human meanings."
1988,76,holy the firm,Annie Dillard,1988,http://books.google.com/books/content?id=ps1LlwEACAAJ&printsec=frontcover&img=1&zoom=1&source=gbs_api,literary criticism,10,25,,"In 1975 Annie Dillard took up residence on an island in Puget Sound in a wooded room furnished with ""one enormous window, one cat, one spider and one person."" For the next two years she asked herself questions about time, reality, sacrifice death, and the will of God. In Holy the Firm she writes about a moth consumed in a candle flame, about a seven-year-old girl burned in an airplane accident, about a baptism on a cold beach. But behind the moving curtain of what she calls ""the hard things -- rock mountain and salt sea,"" she sees, sometimes far off and sometimes as close by as a veil or air, the power play of holy fire. This is a profound book about the natural world -- both its beauty and its cruelty -- the Pulitzer Prize-winning Dillard knows so well."
1989,258,think on these things,Jiddu Krishnamurti,1989,http://books.google.com/books/content?id=QzzbmAEACAAJ&printsec=frontcover&img=1&zoom=1&source=gbs_api,religion,8,22,,"‘The material contained in this volume was originally presented in the form of talks to students, teachers and parents in India, but its keen penetration and lucid simplicity will be deeply meaningful to thoughtful people everywhere, of all ages, and in every walk of life. Krishnamurti examines with characteristic objectivity and insight the expressions of what we are pleased to call our culture, our education, religion, politics and tradition; and he throws much light on such basic emotions as ambition, greed and envy, the desire for security and the lust for power – all of which he shows to be deteriorating factors in human society.’ From the Editor’s Note ‘Krishnamurti’s observations and explorations of modern man’s estate are penetrating and profound, yet given with a disarming simplicity and directness. To listen to him or to read his thoughts is to face oneself and the world with an astonishing morning freshness.’ Anne Marrow Lindbergh"
1990,255,the dance of intimacy,Harriet Lerner,1990,http://books.google.com/books/content?id=tTKc8Aw-GFUC&printsec=frontcover&img=1&zoom=1&source=gbs_api,psychology,9,22,,"In The Dance of Intimacy, the bestselling author of The Dance of Anger outlines the steps to take so that good relationships can be strengthened and difficult ones can be healed. Taking a careful look at those relationships where intimacy is most challenged--by distance, intensity, or pain--she teaches us about the specific changes we can make to achieve a more solid sense of self and a more intimate connectedness with others. Combining clear advice with vivid case examples, Dr. Lerner offers us the most solid, helpful book on intimate relationships that both women and men may ever encounter."
1990,311,tell my horse,Zora Neale Hurston,1990,http://books.google.com/books/content?id=CgolTH6AR8gC&printsec=frontcover&img=1&zoom=1&source=gbs_api,fiction,8,20,,The author recounts her experiences as an initiate into the voodoo practices of Haiti and Jamaica in the 1930s
1990,229,jonah's gourd vine,Zora Neale Hurston,1990,http://books.google.com/books/content?id=g8KrkJIcFgYC&printsec=frontcover&img=1&zoom=1&source=gbs_api,fiction,1,20,,"John Buddy Pearson, a young Black man who becomes a popular pastor at Zion Hope, is unable to reconcile his good intentions and his natural instincts"
1990,448,the chaneysville incident,David Bradley,1990,http://books.google.com/books/content?id=zYOcrhUIRX4C&printsec=frontcover&img=1&zoom=1&source=gbs_api,history,2,24,,"The legends say something happened in Chaneysville. The Chaneysville Incident is the powerful story of one man's obsession with discovering what that something was--a quest that takes the brilliant and bitter young black historian John Washington back through the secrets and buried evil of his heritage. Returning home to care for and then bury his father's closest friend and his own guardian, Old Jack Crawley, he comes upon the scant records of his family's proud and tragic history, which he drives himself to reconstruct and accept. This is the story of John's relationship with his family, the town, and the woman he loves; and also between the past and the present, between oppression and guilt, hate and violence, love and acceptance."
1990,113,the writing life,Annie Dillard,1990,http://books.google.com/books/content?id=leBs_fzkNdkC&printsec=frontcover&img=1&zoom=1&source=gbs_api,literary criticism,10,29,,"Annie Dillard has written eleven books, including the memoir of her parents, An American Childhood; the Northwest pioneer epic The Living; and the nonfiction narrative Pilgrim at Tinker Creek. A gregarious recluse, she is a member of the American Academy of Arts and Letters."
1990,299,the lost continent,Bill Bryson,1990,http://books.google.com/books/content?id=3139wFo58H4C&printsec=frontcover&img=1&zoom=1&source=gbs_api,travel,13,23,,An unsparing and hilarious account of one man's rediscovery of America and his search for the perfect small town.
1990,617,three by annie dillard,Annie Dillard,1990,http://books.google.com/books/content?id=dRo8SwAACAAJ&printsec=frontcover&img=1&zoom=1&source=gbs_api,fiction,15,29,,A stunning collection of Annie Dillard's most popular books in one volume.
1991,341,declarations of independence,Howard Zinn,1991,http://books.google.com/books/content?id=f1wmvgAACAAJ&printsec=frontcover&img=1&zoom=1&source=gbs_api,political science,10,21,,The acclaimed author of A People's History of the United States presents an honest and piercing look at American political ideology.
1996,336,the complete stories,Zora Neale Hurston,1996,http://books.google.com/books/content?id=t2NozDINo3UC&printsec=frontcover&img=1&zoom=1&source=gbs_api,fiction,10,29,,"A collection of short stories, most of which appeared in literary magazines during the author's lifetime, along with previously unpublished works, spans the career of one of the century's foremost African-American writers. Reprint."
1994,320,"legends, lies & cherished myths of world history",Richard Shenkman,1994,http://books.google.com/books/content?id=k_x45UzKZkwC&printsec=frontcover&img=1&zoom=1&source=gbs_api,history,4,28,,"Whistleblowing historian Richard Shenkman skewers the nonsense we were all taught about the world’s revolutions, religions, heroes, and inventors in a whirlwind tour of history. Queen Victoria may have usually worn black, but she loved to drink and party. The English were conned during World War II. Winston Churchill’s famous “finest hour” radio broadcast was not delivered by Winston Churchill but by Norman Shelley, an actor hired to be Churchill’s stand-in. Marie Antoinette did not say, “Let them eat cake,” Churchill didn’t coin the phrase “the Iron Curtain,” and Caesar never said, “Et tu, Brute?” Scandal in the English monarchy is nothing new: Fifteen kings fathered children out of wedlock. One queen helped depose her husband so her lover could take his place. Three English kings were gay. Eclectic, eccentric, edifying, and fun, Richard Shenkman’s eye-opening revelations prove that much of history is indeed “but a fable agreed upon.”"
1994,384,the infinite plan,Isabel Allende,1994,http://books.google.com/books/content?id=80pDRgAcJKIC&printsec=frontcover&img=1&zoom=1&source=gbs_api,fiction,12,28,,"Selling more than 65,000 copies and topping bestseller lists around the world -- including Spain, Germany, Italy, and Latin America -- this novel tells the engrossing story of one man's quest for love and for his soul."
1994,288,soul mates,Thomas Moore,1994,http://books.google.com/books/content?id=7syElddx2b0C&printsec=frontcover&img=1&zoom=1&source=gbs_api,psychology,12,28,,"This companion volume to Care of the Soul offers more of Thomas Moore's inspiring wisdom and empathy as it expands on his ideas about life, love, and the mysteries of human relationships. In Care of the Soul, Thomas Moore explored the importance of nurturing the soul and struck a chord nationwide — the book became a long-term bestseller, topping charts across the country and selling 550,000 copies in hardcover and paperback combined. Building on that book's wisdom, Soul Mates, already a hardcover bestseller, explores how relationships of all kinds enhance our lives and fulfill the needs of our souls. Moore emphasizes the difficulties that inevitably accompany many relationships and focuses on the need to work through these differences in order to experience the deep reward that comes with intimacy and unconfined love."
1995,368,"cathedral, forge and waterwheel",Joseph Gies,1995,http://books.google.com/books/content?id=Rw0oTHwz264C&printsec=frontcover&img=1&zoom=1&source=gbs_api,history,13,21,,"An illuminating look at the monumental inventions of the Middle Ages, by the authors of Life in a Medieval Castle."
1996,240,the throne of the third heaven of the nations millennium general assembly,Denis Johnson,1996,http://books.google.com/books/content?id=RCRllwEACAAJ&printsec=frontcover&img=1&zoom=1&source=gbs_api,poetry,4,25,,"From the award-winning poet and novelist—a must-have collection of his four previous books of poetry plus a selection of new, unpublished work."
1996,192,success stories,Russell Banks,1996,http://books.google.com/books/content?id=bGIs7R90isEC&printsec=frontcover&img=1&zoom=1&source=gbs_api,fiction,5,26,,"In Sucess Stories, an exceptionally varied yet coherent collection, Russell Banks proves himself one of the most astute and forceful writers in America today. Queen for a Day, Success Story, and Adultery trace fortunes of the Painter family in there pursuit of and retreat from the American dream. Banks also explores the ethos of rampant materialism in a group of contemporary moral fables. The Fish is an evocating parable of faith and greed set in a Southeast Asian village, The Gully tells of the profitability of violence and the ironies of upward mobility in a Latin American shantytown, and Chrildren's Story explores the repressed rage that boils beneath the surface of relationships between parents and children and between citizens of the first and third worlds."
1996,288,testaments betrayed,Milan Kundera,1996,http://books.google.com/books/content?id=gWzdD3wGV8MC&printsec=frontcover&img=1&zoom=1&source=gbs_api,literary collections,3,29,,"Milan Kundera has established himself as one of the great novelists of our time with such books as The Unbearable Lightness of Being, Immortality and The Book of Laughter and Forgetting. In Testaments Betrayed, he proves himself a brilliant defender of the moral rights of the artist and the respect due to a work of art and its creator's wishes. The betrayal of both—often by their most passionate proponents—is the principal theme of this extraordinary work. Readers will be particularly intrigued by Kundera's impassioned attack on society's shifting moral judgments and persecutions of art and artists, from Mayakovsky to Rushdie."
1996,256,mr. ives' christmas,Oscar Hijuelos,1996,http://books.google.com/books/content?id=Z7XK28QOcWAC&printsec=frontcover&img=1&zoom=1&source=gbs_api,fiction,3,23,,"Hijuelos' novel tells the story of Mr. Ives, who was adopted from a foundling's home as a child. When we first meet him in the 1950s, Mr. Ives is very much a product of his time. He has a successful career in advertising, a wife and two children, and believes he is on his way to pursuing the typical American dream. But the dream is shattered when his son Robert, who is studying for the priesthood, is killed violently at Christmas. Overwhelmed by grief and threatened by a loss of faith in humankind, Mr. Ives begins to question the very foundations of his life. Part love story--of a man for his wife, for his children, for God--and part meditation on how a person can find spiritual peace in the midst of crisis, Mr. Ives' Christmas is a beautifully written, tender and passionate story of a man trying to put his life in perspective. In the expert hands of Oscar Hijuelos, the novel speaks eloquently to the most basic and fulfilling aspects of life for all of us."
1997,156,slowness,Milan Kundera,1997,http://books.google.com/books/content?id=czPAd_xrPyMC&printsec=frontcover&img=1&zoom=1&source=gbs_api,fiction,1,26,,"Milan Kundera's lightest novel, a divertimento, an opera buffa, Slowness is also the first of this author's fictional works to have been written in French. Disconcerted and enchanted, the reader follows the narrator of Slowness through a midsummer's night in which two tales of seduction, separated by more than two hundred years, interweave and oscillate between the sublime and the comic. Underlying this libertine fantasy is a profound meditation on contemporary life: about the secret bond between slowness and memory, about the connection between our era's desire to forget and the way we have given ourselves over to the demon of speed. And about ""dancers"" possessed by the passion to be seen, for whom life is merely a perpetual show emptied of every intimacy and every joy."
2001,320,as nature made him,John Colapinto,2001,http://books.google.com/books/content?id=92jVVLpg3rcC&printsec=frontcover&img=1&zoom=1&source=gbs_api,medical,8,22,,Tells the story of a man whose botched circumcision as a baby and subsequent surgical alteration to a female was mistakenly used as an argument for the success of such procedures.
1999,288,the active side of infinity,Carlos Castaneda,1999,http://books.google.com/books/content?id=e82-B-6eh7gC&printsec=frontcover&img=1&zoom=1&source=gbs_api,"body, mind & spirit",15,22,,"""Ordinarily, events that change our path are impersonal affairs, and yet extremely personal. My teacher, don Juan Matsus, said this is guiding me as his apprentice to collect what I considered to be the memorable events of my life…. Don Juan described the total goal of the shamanistic knowledge that he handled as the preparation for facing the definitive journey: the journey that every human being has to take at the end of his life. He said that what modern man referred to vaguely as life after death was, for those shamans, a concrete region filled to capacity with practical affairs of a different order than the practical affairs of daily life, yet bearing a similar functional practicality. Don Juan considered that to collect the memorable in their lives was, for shamans, the preparation for their entrance into that concrete region, which they called the active side of infinity."" In this book written immediately before his death, anthropologist and shaman Carlos Castaneda gives us his most autobiographical and intimately revealing work ever, the fruit of a lifetime of experience and perhaps the most moving volume in his oeuvre."
1998,288,brave new world,Aldous Huxley,1998,http://books.google.com/books/content?id=-iU5Aq3WuGgC&printsec=frontcover&img=1&zoom=1&source=gbs_api,fiction,3,27,,Huxley's classic prophetic novel describes the socialized horrors of a futuristic utopia devoid of individual freedom
1998,711,you can't go home again,Thomas Wolfe,1998,http://books.google.com/books/content?id=0yMZeA9tHOAC&printsec=frontcover&img=1&zoom=1&source=gbs_api,fiction,3,25,,Novelist George Webber is driven from his hometown when his successful autobiographical novel infuriates the family and friends he has depicted in it
1999,256,the fifth mountain,Paulo Coelho,1999,http://books.google.com/books/content?id=HKq_H_z2XsYC&printsec=frontcover&img=1&zoom=1&source=gbs_api,fiction,9,20,,"Elijah, a biblical prophet in the Middle East during the ninth century B.C., confronts the pagan princess Jezebel and finds love in the strange land of Zarephath with a young widow, only to have his new-found happiness shattered by tragedy"
1999,547,v.,Thomas Pynchon,1999,http://books.google.com/books/content?id=jqS2pmUIfOAC&printsec=frontcover&img=1&zoom=1&source=gbs_api,fiction,1,20,,"The wild, macabre tale of the twentieth century and of two men -- one looking for something he has lost, the other with nothing much to lose -- and ""V.,"" the unknown woman of the title."
1999,168,identity,Milan Kundera,1999,http://books.google.com/books/content?id=mXPU2T--gPQC&printsec=frontcover&img=1&zoom=1&source=gbs_api,fiction,1,27,,"There are situations in which we fail for a moment to recognize the person we are with, in which the identity of the other is erased while we simultaneously doubt our own. This also happens with couples--indeed, above all with couples, because lovers fear more than anything else ""losing sight"" of the loved one. With stunning artfulness in expanding and playing variations on the meaningful moment, Milan Kundera has made this situation--and the vague sense of panic it inspires--the very fabric of his new novel. Here brevity goes hand in hand with intensity, and a moment of bewilderment marks the start of a labyrinthine journey during which the reader repeatedly crosses the border between the real and the unreal, between what occurs in the world outside and what the mind creates in its solitude. Of all contemporary writers, only Kundera can transform such a hidden and disconcerting perception into the material for a novel, one of his finest, most painful, and most enlightening. Which, surprisingly, turns out to be a love story."
1999,546,the poisonwood bible,Barbara Kingsolver,1999,http://books.google.com/books/content?id=xl1mxRJd00MC&printsec=frontcover&img=1&zoom=1&source=gbs_api,fiction,12,20,,"Nathan Price, a evangelical Baptist who in 1959 has taken his wife and four daughters on a mission to the Belgian Congo, finds that their traditions are no longer secure in this very different world. Reprint. 250,000 first printing."
