published_year,num_pages,book_Title,Book_Author,year_of_Publication,image,categoryname,price,inStock,category,description
2004,247,gilead,Marilynne Robinson,2004,http://books.google.com/books/content?id=KQZCPgAACAAJ&printsec=frontcover&img=1&zoom=1&source=gbs_api,fiction,1,21,,"A NOVEL THAT READERS and critics have been eagerly anticipating for over a decade, Gilead is an astonishingly imagined story of remarkable lives. John Ames is a preacher, the son of a preacher and the grandson (both maternal and paternal) of preachers. It’s 1956 in Gilead, Iowa, towards the end of the Reverend Ames’s life, and he is absorbed in recording his family’s story, a legacy for the young son he will never see grow up. Haunted by his grandfather’s presence, John tells of the rift between his grandfather and his father: the elder, an angry visionary who fought for the abolitionist cause, and his son, an ardent pacifist. He is troubled, too, by his prodigal namesake, Jack (John Ames) Boughton, his best friend’s lost son who returns to Gilead searching for forgiveness and redemption. Told in John Ames’s joyous, rambling voice that finds beauty, humour and truth in the smallest of life’s details, Gilead is a song of celebration and acceptance of the best and the worst the world has to offer. At its heart is a tale of the sacred bonds between fathers and sons, pitch-perfect in style and story, set to dazzle critics and readers alike."
2000,241,spider's web,Charles Osborne;Agatha Christie,2000,http://books.google.com/books/content?id=gA5GPgAACAAJ&printsec=frontcover&img=1&zoom=1&source=gbs_api,detective and mystery stories,10,29,,"A new 'Christie for Christmas' -- a full-length novel adapted from her acclaimed play by Charles Osborne Following BLACK COFFEE and THE UNEXPECTED GUEST comes the final Agatha Christie play novelisation, bringing her superb storytelling to a new legion of fans. Clarissa, the wife of a Foreign Office diplomat, is given to daydreaming. 'Supposing I were to come down one morning and find a dead body in the library, what should I do?' she muses. Clarissa has her chance to find out when she discovers a body in the drawing-room of her house in Kent. Desperate to dispose of the body before her husband comes home with an important foreign politician, Clarissa persuades her three house guests to become accessories and accomplices. It seems that the murdered man was not unknown to certain members of the house party (but which ones?), and the search begins for the murderer and the motive, while at the same time trying to persuade a police inspector that there has been no murder at all... SPIDER'S WEB was written in 1954 specifically for Margaret Lockwood and opened first at the Theatre Royal Nottingham before moving to the Savoy Theatre in London on 14 December 1954. With THE MOUSETRAP and WI"
1982,479,the one tree,Stephen R. Donaldson,1982,http://books.google.com/books/content?id=OmQawwEACAAJ&printsec=frontcover&img=1&zoom=1&source=gbs_api,fiction,15,21,,Volume Two of Stephen Donaldson's acclaimed second trilogy featuing the compelling anti-hero Thomas Covenant.
1993,512,rage of angels,Sidney Sheldon,1993,http://books.google.com/books/content?id=FKo2TgANz74C&printsec=frontcover&img=1&zoom=1&source=gbs_api,fiction,5,30,,"A memorable, mesmerizing heroine Jennifer -- brilliant, beautiful, an attorney on the way up until the Mafia's schemes win her the hatred of an implacable enemy -- and a love more destructive than hate. A dangerous, dramatic world The Dark Arena of organized crime and flashbulb lit courtrooms where ambitious prosecutors begin their climb to political power."
1982,489,master of the game,Sidney Sheldon,1982,http://books.google.com/books/content?id=TkTYp-Tp6_IC&printsec=frontcover&img=1&zoom=1&source=gbs_api,adventure stories,12,23,,Kate Blackwell is an enigma and one of the most powerful women in the world. But at her ninetieth birthday celebrations there are ghosts of absent friends and absent enemies.
1994,501,if tomorrow comes,Sidney Sheldon,1994,http://books.google.com/books/content?id=l2tBi_jLuk8C&printsec=frontcover&img=1&zoom=1&source=gbs_api,adventure stories,10,28,,"One of Sidney Sheldon's most popular and bestselling titles, repackaged and reissued for a new generation of fans."
1996,460,assassin's apprentice,Robin Hobb,1996,http://books.google.com/books/content?id=qTaGQgAACAAJ&printsec=frontcover&img=1&zoom=1&source=gbs_api,fiction,10,29,,Fantasy-roman.
1995,522,warhost of vastmark,Janny Wurts,1995,http://books.google.com/books/content?id=uOL0fpS9WZkC&printsec=frontcover&img=1&zoom=1&source=gbs_api,fiction,9,20,,"Tricked once more by his wily half-brother, Lysaer, Lord of Light, arrives at the tiny harbor town of Merior to find that Arithon's ship yards have been abandoned and meticulously destroyed, and that the Master of Shadow has disappeared as if into thin air. Meanwhile Arithon and the Mad Prophet Dakar are traveling on foot through the treacherous Kelhorn Mountains towards the Vastmark clans, there to raise further support for his cause. But raising a warhost is a costly business. Is it mere coincidence that Princess Talith—Lysaer's beautiful, headstrong wife—is taken captive and held for a vast ransom by a master brigand? The forces of light and shadow circle and feint, drawing ever closer to a huge conflict. And in the background the Fellowship of Seven Sorcerers and the Koriani Enchantresses watch and plan, and wait."
2003,337,murder in lamut,Raymond E. Feist;Joel Rosenberg,2003,http://books.google.com/books/content?id=I2jbBlMHlAMC&printsec=frontcover&img=1&zoom=1&source=gbs_api,adventure stories,3,27,,"Available in the U.S. for the first time, this is the second volume in the exceptional Legends of the Riftwar series from ""New York Times""-bestselling authors Feist and Rosenberg."
2003,368,jimmy the hand,Raymond E. Feist;S. M. Stirling,2003,http://books.google.com/books/content?id=hV4-oITYFN8C&printsec=frontcover&img=1&zoom=1&source=gbs_api,fiction,8,20,,"Jimmy the Hand, boy thief of Krondor, lived in the shadows of the city. Though gifted beyond his peers, Jimmy is merely a pickpocket with potential--until he aids Prince Arutha in the rescue of Princess Anita from Duke Guy du Bas-Tyra, and runs afoul of ""Black Guy's"" secret police. Facing a choice between disappearing on his own or in a weighted barrel at the bottom of Krondor's harbor, Jimmy chooses the former. Forced to flee the only home he's ever known, Jimmy finds himself among the unsuspecting rural villagers of Land's End, where he hopes to prosper with his talents for con and thievery. But Land's End is home to many who tread the crooked path--and to a dark, dangerous presence even the local smugglers don't recognize. And suddenly Jimmy's youthful bravado and courage are leading him into the maw of chaos . . . and, quite possibly, to his doom."
1996,576,mystical paths,Susan Howatch,1996,http://books.google.com/books/content?id=by4ytBy63o0C&printsec=frontcover&img=1&zoom=1&source=gbs_api,fiction,1,28,,1968 finds Nicholas Darrow wrestling with personal problems. How can he marry Rosalind when he is unable to avoid promiscuity? How can he become a priest when he finds it so difficult to live as one? And can he break his dangerous dependence on his father?
1996,512,glittering images,Susan Howatch,1996,http://books.google.com/books/content?id=rDHbn0ORKhQC&printsec=frontcover&img=1&zoom=1&source=gbs_api,fiction,1,28,,"It is 1937, and Charles Ashworth, a Canon to the Archbishop of Canterbury, is sent to untangle a web of self-delusion and corruption at the episcopal palace of the charismatic Bishop of Starbridge."
2000,906,the mad ship,Robin Hobb,2000,http://books.google.com/books/content?id=2iWezkfdBE8C&printsec=frontcover&img=1&zoom=1&source=gbs_api,fiction,4,26,,"Fantasy master Robin Hobb delivers the stunning second volume of her Liveship Traders trilogy, returning to the timeless city of Bingtown, where pirates now plague the coasts and the dreaded slave trade flourishes. Althea Vestrit doesnt have time to be afraid, for her familys newly awakened Liveship, Vivacia, has been seized by the ruthless pirate Kennit. So Althea hatches a bold plan. But to carry it out, she must recruit a Liveship that has already slain two crews -- and is said to be insane."
1997,261,the reverse of the medal,Patrick O'Brian,1997,http://books.google.com/books/content?id=YtjxFRb39Z4C&printsec=frontcover&img=1&zoom=1&source=gbs_api,adventure stories,11,22,,"In this book, Jack Aubrey returns from his duties protecting whalers off the South American coast and is persuaded by a casual acquaintance to make investments in the City on the strength of supposedly certain information. From there he is led into the half-worlds of the London criminal underground and of government espionage - the province of his friend, Stephen Maturin."
2000,586,girls' night in,Jessica Adams;Chris Manby;Fiona Walker,2000,http://books.google.com/books/content?id=xLwHHQAACAAJ&printsec=frontcover&img=1&zoom=1&source=gbs_api,fiction,6,23,,"'Girls' Night In' features stories about growing up, growing out of, moving out, moving on, falling apart and getting it all together. So turn off your cell phone and curl up on the couch: this is one 'Girls' Night In' you won't want to miss."
2002,32,ocean star express,Mark Haddon;Peter Sutton,2002,http://books.google.com/books/content?id=I2QZAAAACAAJ&printsec=frontcover&img=1&zoom=1&source=gbs_api,fiction,12,29,,"Joe and his parents are enjoying a summer holiday by the sea at the Ocean Star Hotel. The sky is bright blue, the sun shines and Joe loves all that the seaside has to offer. But when the fog rolls in and rain falls Joe begins to wish that he was back at home again. Things change, however, when the owner of the hotel invites Joe to share in a magical world, only a few steps away. The loft is black as night but then above Joe's head a thousand tiny stars begin to sparkle and in the distance he hears the chug-chug-chug of a model train. A whole world is soon to open up before Joe's eyes, a world of snow-capped mountains, great deserts, and rocking fishing boats."
2001,176,tree and leaf,John Ronald Reuel Tolkien,2001,http://books.google.com/books/content?id=aPb_AAIcwZ0C&printsec=frontcover&img=1&zoom=1&source=gbs_api,literary collections,8,26,,"""The two works 'On fairy-stories' and 'Leaf by Niggle' were first brought together to form the book 'Tree and leaf' in 1964. In this new edition a third element is added: the poem Mythopoeia, the making of myths...""--Preface."
2001,264,murder in mesopotamia,Agatha Christie,2001,http://books.google.com/books/content?id=oFkbc7BbYN0C&printsec=frontcover&img=1&zoom=1&source=gbs_api,detective and mystery stories,14,25,,"An archaeologist's wife is murdered on the shores of the River Tigris in Iraq... It was clear to Amy Leatheran that something sinister was going on at the Hassanieh dig in Iraq; something associated with the presence of 'Lovely Louise', wife of celebrated archaeologist Dr Leidner. In a few days' time Hercule Poirot was due to drop in at the excavation site. But with Louise suffering from terrifying hallucinations, and tension within the group becoming almost unbearable, Poirot might just be too late..."
2001,333,death in the clouds,Agatha Christie,2001,http://books.google.com/books/content?id=M8iyckq4GQ0C&printsec=frontcover&img=1&zoom=1&source=gbs_api,detective and mystery stories,1,20,,"A woman is killed by a poisoned dart in the enclosed confines of a commercial passenger plane... From seat No.9, Hercule Poirot was ideally placed to observe his fellow air passengers. Over to his right sat a pretty young woman, clearly infatuated with the man opposite; ahead, in seat No.13, sat a Countess with a poorly-concealed cocaine habit; across the gangway in seat No.8, a detective writer was being troubled by an aggressive wasp. What Poirot did not yet realize was that behind him, in seat No.2, sat the slumped, lifeless body of a woman."
2001,303,appointment with death,Agatha Christie,2001,http://books.google.com/books/content?id=lSYwsRkcw4YC&printsec=frontcover&img=1&zoom=1&source=gbs_api,detective and mystery stories,12,30,,"A repugnant Amercian widow is killed during a trip to Petra... Among the towering red cliffs of Petra, like some monstrous swollen Buddha, sat the corpse of Mrs Boynton. A tiny puncture mark on her wrist was the only sign of the fatal injection that had killed her. With only 24 hours available to solve the mystery, Hercule Poirot recalled a chance remark he'd overheard back in Jerusalem: 'You see, don't you, that she's got to be killed?' Mrs Boynton was, indeed, the most detestable woman he'd ever met..."
2002,272,the big four,Agatha Christie,2002,http://books.google.com/books/content?id=wcOQUSWQEdUC&printsec=frontcover&img=1&zoom=1&source=gbs_api,detective and mystery stories,1,25,,"A ruthless international cartel seeks world domination... Framed in the doorway of Poirot's bedroom stood an uninvited guest, coated from head to foot in dust. The man's gaunt face stared for a moment, then he swayed and fell. Who was he? Was he suffering from shock or just exhaustion? Above all, what was the significance of the figure 4, scribbled over and over again on a sheet of paper? Poirot finds himself plunged into a world of international intrigue, risking his life to uncover the truth about 'Number Four'."
2002,284,they do it with mirrors,Agatha Christie,2002,http://books.google.com/books/content?id=HUuQYGppZi8C&printsec=frontcover&img=1&zoom=1&source=gbs_api,fiction,10,24,,"A man is shot at in a juvenile reform home - but someone else dies... Miss Marple senses danger when she visits a friend living in a Victorian mansion which doubles as a rehabilitiation centre for delinquents. Her fears are confirmed when a youth fires a revolver at the administrator, Lewis Serrocold. Neither is injured. But a mysterious visitor, Mr Gilbrandsen, is less fortunate - shot dead simultaneously in another part of the building. Pure coincidence? Miss Marple thinks not, and vows to discover the real reason for Mr Gilbrandsen's visit."
2002,352,taken at the flood,Agatha Christie,2002,http://books.google.com/books/content?id=3gWlxIFlMEwC&printsec=frontcover&img=1&zoom=1&source=gbs_api,fiction,13,29,,"A Few Weeks After Marrying An Attractive Young Widow, Gordon Cloade Is Tragically Killed By A Bomb Blast In The London Blitz. Overnight, The Former Mrs Underhay Finds Herself In Sole Possession Of The Cloade Family Fortune. Shortly Afterwards, Hercule Poirot Receives A Visit From The Dead Man S Sister-In-Law Who Claims She Has Been Warned By Spirits That Mrs Underhay S First Husband Is Still Alive. Poirot Has His Suspicions When He Is Asked To Find A Missing Person Guided Only By The Spirit World. Yet What Mystifies Poirot Most Is The Woman S True Motive For Approaching Him&"
2002,384,the hollow,Agatha Christie,2002,http://books.google.com/books/content?id=-f1h4e0hl0oC&printsec=frontcover&img=1&zoom=1&source=gbs_api,detective and mystery stories,2,28,,"Lucy Angkatell Invited Hercule Poirot To Lunch. To Tease The Great Detective, Her Guests Stage A Mock Murder Beside The Swimming Pool. Unfortunately, The Victim Plays The Scene For Real. As His Blood Drips Into The Water, John Christow Gasps One Final Word: Henrietta . In The Confusion, A Gun Sinks To The Bottom Of The Pool. Poirot S Enquiries Reveal A Complex Web Of Romantic Attachments. It Seems Everyone In The Drama Is A Suspect And Each A Victim Of Love."
2004,527,lirael,Garth Nix,2004,http://books.google.com/books/content?id=sDzU8TpKvQAC&printsec=frontcover&img=1&zoom=1&source=gbs_api,fiction,4,28,,"When a dangerous necromancer threatens to unleash a long-buried evil, Lirael and Prince Sameth are drawn into a battle to save the Old Kingdom and reveal their true destinies. Suggested level: secondary."
2007,414,the yiddish policemen's union,Michael Chabon,2007,http://books.google.com/books/content?id=-reD1g77BfsC&printsec=frontcover&img=1&zoom=1&source=gbs_api,fiction,2,28,,"For sixty years, Jewish refugees and their descendants have prospered in the Federal District of Sitka, a ""temporary"" safe haven created in the wake of revelations of the Holocaust and the shocking 1948 collapse of the fledgling state of Israel. Proud, grateful, and longing to be American, the Jews of the Sitka District have created their own little world in the Alaskan panhandle, a vibrant, gritty, soulful, and complex frontier city that moves to the music of Yiddish. For sixty years they have been left alone, neglected and half-forgotten in a backwater of history. Now the District is set to revert to Alaskan control, and their dream is coming to an end: once again the tides of history threaten to sweep them up and carry them off into the unknown. But homicide detective Meyer Landsman of the District Police has enough problems without worrying about the upcoming Reversion. His life is a shambles, his marriage a wreck, his career a disaster. He and his half-Tlingit partner, Berko Shemets, can't catch a break in any of their outstanding cases. Landsman's new supervisor is the love of his life—and also his worst nightmare. And in the cheap hotel where he has washed up, someone has just committed a murder—right under Landsman's nose. Out of habit, obligation, and a mysterious sense that it somehow offers him a shot at redeeming himself, Landsman begins to investigate the killing of his neighbor, a former chess prodigy. But when word comes down from on high that the case is to be dropped immediately, Landsman soon finds himself contending with all the powerful forces of faith, obsession, hopefulness, evil, and salvation that are his heritage—and with the unfinished business of his marriage to Bina Gelbfish, the one person who understands his darkest fears. At once a gripping whodunit, a love story, an homage to 1940s noir, and an exploration of the mysteries of exile and redemption, The Yiddish Policemen's Union is a novel only Michael Chabon could have written."
2003,242,"beware, princess elizabeth",Carolyn Meyer,2003,http://books.google.com/books/content?id=wPBpR4AFNJ0C&printsec=frontcover&img=1&zoom=1&source=gbs_api,children's stories,13,26,,A matter of life and death - and the Throne of England
2002,303,endless night,Agatha Christie,2002,http://books.google.com/books/content?id=kY1wuNfgmFQC&printsec=frontcover&img=1&zoom=1&source=gbs_api,fiction,6,23,," Gipsy S Acre Was A Truly Beautiful Upland Site With Views Out To Sea And In Michael Rogers It Stirred A Child-Like Fantasy. There, Among The Dark Fir Trees, He Planned To Build A House, Find A Wonderful Girl And Live Happily Ever After, Yet, As He Left The Village, A Shadow Of Menace Hung Over The Land. For This Was The Place Where Accidents Happened. Perhaps Michael Should Have Heeded The Locals Warnings: There S No Luck For Them As Meddles With Gipsy S Acre ."
2004,306,how to be alone,Jonathan Franzen,2004,http://books.google.com/books/content?id=ozVWaXd9xvwC&printsec=frontcover&img=1&zoom=1&source=gbs_api,literary collections,7,25,,"'The Harper's Essay' is reprinted in this volume alongside personal essays and painstaking, often funny reportage. Although his subjects range widely, each piece wrestles with the erosion of civic life and private dignity, and the hidden persistence of loneliness in postmodern America."
2003,396,the mysterious mr. quin,Agatha Christie,2003,http://books.google.com/books/content?id=n0aMDV7Lm4sC&printsec=frontcover&img=1&zoom=1&source=gbs_api,detective and mystery stories,6,22,,"A mysterious stranger appears at a New Year's Eve party, becoming the enigmatic sleuthing sidekick to the snobbish Mr Satterthwaite... So far, it had been a typical New Year's Eve house party. But Mr Satterthwaite - a keen observer of human nature - sensed that the real drama of the evening was yet to unfold. So it proved when a mysterious stranger arrived after midnight. Who was this Mr Quin? And why did his presence have such a pronounced effect on Eleanor Portal, the woman with the dyed-black hair?"
2003,317,the listerdale mystery,Agatha Christie,2003,http://books.google.com/books/content?id=J1tLGz5G84EC&printsec=frontcover&img=1&zoom=1&source=gbs_api,detective and mystery stories,3,29,,"A selection of mysteries, some light-hearted, some romantic, some very deadly... Twelve tantalizing cases... the curious disappearance of Lord Listerdale; a newlywed's fear of her ex-fiance; a strange encounter on a train; a domestic murder investigation; a wild man's sudden personality change; a retired inspector's hunt for a murderess; a young woman's impersonation of a duchess; a necklace hidden in a basket of cherries; a mystery writer's arrest for murder; an astonishing marriage proposal; a soprano's hatred for a baritone; the case of the rajah's emerald. All have one thing in common: the skilful hand of Agatha Christie."
2004,384,the real trial of oscar wilde,Merlin Holland,2004,http://books.google.com/books/content?id=QfNgQfTKcg0C&printsec=frontcover&img=1&zoom=1&source=gbs_api,biography & autobiography,14,20,,"Oscar Wilde had one of literary history's most explosive love affairs with Lord Alfred ""Bosie"" Douglas. In 1895, Bosie's father, the Marquess of Queensberry, delivered a note to the Albemarle Club addressed to ""Oscar Wilde posing as sodomite."" With Bosie's encouragement, Wilde sued the Marquess for libel. He not only lost but he was tried twice for ""gross indecency"" and sent to prison with two years' hard labor. With this publication of the uncensored trial transcripts, readers can for the first time in more than a century hear Wilde at his most articulate and brilliant. The Real Trial of Oscar Wilde documents an alarmingly swift fall from grace; it is also a supremely moving testament to the right to live, work, and love as one's heart dictates."
2003,48,"oh, the places you'll go!",Dr. Seuss,2003,http://books.google.com/books/content?id=Ev4Llq5fv4IC&printsec=frontcover&img=1&zoom=1&source=gbs_api,adventure stories,4,20,,From bang-ups and hang-ups to lurches and slumps. Dr. Seuss takes a hilarious look at the mishaps and misadventures that life may have in store for us.
2004,386,the silmarillion,John Ronald Reuel Tolkien;Ted Nasmith,2004,http://books.google.com/books/content?id=hLH0dtl5NVwC&printsec=frontcover&img=1&zoom=1&source=gbs_api,fiction,10,28,,"Designed to take fans of The Hobbit and The Lord of the Rings deeper into the myths and legends of Middle-earth The Silmarillion is an account of the Elder Days, of the First Age of Tolkien s world. It is the ancient drama to which the characters in The Lord of the Rings look back, and in whose events some of them such as Elrond and Galadriel took part. The tales of The Silmarillion are set in an age when Morgoth, the first Dark Lord, dwelt in Middle-Earth, and the High Elves made war upon him for the recovery of the Silmarils, the jewels containing the pure light of Valinor. Included in the book are several shorter works. The Ainulindale is a myth of the Creation and in the Valaquenta the nature and powers of each of the gods is described. The Akallabeth recounts the downfall of the great island kingdom of Numenor at the end of the Second Age and Of the Rings of Power tells of the great events at the end of the Third Age, as narrated in The Lord of the Rings. This pivotal work features the revised, corrected text and includes, by way of an introduction, a fascinating letter written by Tolkien in 1951 in which he gives a full explanation of how he conceived the early Ages of Middle-earth."""
2004,64,i wish that i had duck feet,Dr. Seuss;Barney Tobey,2004,http://books.google.com/books/content?id=m9cZAAAACAAJ&printsec=frontcover&img=1&zoom=1&source=gbs_api,children's stories,11,24,,"A boy imagines what it would be like if he had such things as duck feet, a whale spout, and an elephant's trunk."
2004,36,oh say can you say?,Dr. Seuss,2004,http://books.google.com/books/content?id=r4l8AAAACAAJ&printsec=frontcover&img=1&zoom=1&source=gbs_api,children's stories,2,20,,Tie your tongue in terrible knots as you try to read aloud. Nonsense rhyming story.
2005,336,tropic of cancer,Henry Miller,2005,http://books.google.com/books/content?id=ProgRjTL8FIC&printsec=frontcover&img=1&zoom=1&source=gbs_api,fiction,3,30,,"Miller's groundbreaking first novel, banned in Britain for almost thirty years, now reinvigorated in a new Harper Perennial Modern Classics edition. A penniless and as yet unpublished writer, Henry Miller arrived in Paris in 1930. Leaving behind a disintegrating marriage and an unhappy career in America, he threw himself into the low-life of bohemian Paris with unwavering gusto. A fictional account of Miller's adventures amongst the prostitutes and pimps, the penniless painters and writers of Montparnasse, Tropic of Cancer is an extravagant and rhapsodic hymn to a world of unrivalled eroticism and freedom. Tropic of Cancer's 1934 publication in France was hailed by Samuel Beckett as 'a momentous event in the history of modern writing'. The novel was subsequently banned in the UK and the USA and not released for publication for a further thirty years."
1994,169,the love of the last tycoon,F. Scott Fitzgerald,1994,http://books.google.com/books/content?id=3EDbEHca_k8C&printsec=frontcover&img=1&zoom=1&edge=curl&source=gbs_api,fiction,8,26,,Depicts the inner-workings of the Hollywood movie industry and its impact on the fabric of American life.
