published_year,num_pages,book_Title,Book_Author,year_of_Publication,image,categoryname,price,inStock,category,description
2006,448,the black dahlia files,Don Wolfe,2006,http://books.google.com/books/content?id=F6PpPrKuUaMC&printsec=frontcover&img=1&zoom=1&source=gbs_api,true crime,5,28,,"In 1946, Elizabeth Short traveled to Hollywood to become famous and see her name up in lights. Instead, the dark-haired beauty became immortalized in the headlines as the ""Black Dahlia"" when her nude and bisected body was discovered in the weeds of a vacant lot. Despite the efforts of more than four hundred police officers and homicide investigators, the heinous crime was never solved. Now, after endless speculation and false claims, bestselling author Donald H. Wolfe discovers startling new evidence—buried in the files of the Los Angeles District Attorney's Office for more than half a century. With the aid of archival photos, news clippings, and investigative reports, Wolfe documents the riveting untold story that names the brutal murderer—the notorious Mafia leader, Benjamin ""Bugsy"" Siegel—and the motive—an unwanted pregnancy resulting from Short's involvement with the most powerful figure in Los Angeles, Norman Chandler. But Wolfe goes even further to unravel the large-scale cover-up behind the case. Wolfe's extensive research, based on the evidence he discovered in the recently opened LADA files, makes The Black Dahlia Files the authoritative work on the murder that has drawn endless scrutiny but remained unsolved—until now."
2005,374,metro girl,Janet Evanovich,2005,http://books.google.com/books/content?id=X0OYbJSjxqYC&printsec=frontcover&img=1&zoom=1&source=gbs_api,fiction,11,29,,"Alexandra (Barney) Barnaby roars onto the Miami Beach scene in hot pursuit of her missing baby brother, ""Wild"" Bill. Leave it to the maverick of the family to get Barney involved with high-speed car chases, a search for sunken treasure, and Sam Hooker, a NASCAR driver who’s good at revving a woman's engine. Engaged in a deadly race, Bill has ""borrowed"" Hooker's sixty-five-foot Hatteras and sailed off into the sunset...just when Hooker has plans for the boat. Hooker figures he'll attach himself to Barney and maybe run into scumbag Bill. And better yet, maybe he'll get lucky in love with Bill's sweetie pie sister. The pedal will have to go to metal if Barney and Hooker want to be the first to cross the finish line, save Bill, Hooker's boat...and maybe the world."
2006,312,motor mouth,Janet Evanovich,2006,http://books.google.com/books/content?id=mG5p4QA2zOwC&printsec=frontcover&img=1&zoom=1&source=gbs_api,fiction,12,20,,"Alexandra ""Barney"" Barnaby returns to take on a whole new set of bad guys, Florida heat, colorful and dangerous characters, and high-stakes adventure, all the while romancing gorgeous race car driver Sam Hooker, in an action-packed sequel to Metro Girl. 1,000,000 first printing."
2003,416,mystic river,Dennis Lehane,2003,http://books.google.com/books/content?id=2U-ivgEACAAJ&printsec=frontcover&img=1&zoom=1&source=gbs_api,fiction,7,30,,"When they were children, Sean Devine, Jimmy Marcus, and Dave Boyle were friends. But then a strange car pulled up to their street. One boy got into the car, two did not, and something terrible happened -- something that ended their friendship and changed all three boys forever. Twenty-five years later, Sean is a homicide detective. Jimmy is an ex-con who owns a corner store. And Dave is trying to hold his marriage together and keep his demons at bay -- demons that urge him to do terrible things. When Jimmy's daughter is found murdered, Sean is assigned to the case. His investigation brings him into conflict with Jimmy, who finds his old criminal impulses tempt him to solve the crime with brutal justice. And then there is Dave, who came home the night Jimmy's daughter died covered in someone else's blood. A tense and unnerving psychological thriller, Mystic River is also an epic novel of love and loyalty, faith and family, in which people irrevocably marked by the past find themselves on a collision course with the darkest truths of their own hidden selves."
2004,512,great short works of herman melville,Herman Melville,2004,http://books.google.com/books/content?id=6WgbDCDIe-QC&printsec=frontcover&img=1&zoom=1&source=gbs_api,fiction,12,23,,"Billy Budd, Sailor and Bartleby, the Scrivener are two of the most revered shorter works of fiction in history. Here, they are collected along with 19 other stories in a beautifully redesigned collection that represents the best short work of an American master.As Warner Berthoff writes in his introduction to this volume, ""It is hard to think of a major novelist or storyteller who is not also a first-rate entertainer . . . a master, according to choice, of high comedy, of one or another robust species of expressive humour, or of some special variety of the preposterous, the grotesque, the absurd. And Melville, certainly, is no exception. A kind of vigorous supervisory humour is his natural idiom as a writer, and one particular attraction of his shorter work is the fresh further display it offers of this prime element in his literary character."""
2006,64,the day i swapped my dad for two goldfish,Neil Gaiman,2006,http://books.google.com/books/content?id=6EqMPwAACAAJ&printsec=frontcover&img=1&zoom=1&source=gbs_api,fiction,4,28,,"""I'll swap you my dad,"" I said. ""Oh-oh,"" said my little sister. What if you wanted your best friend's two goldfish so much that you'd swap anything for them, even your father? What if your mother came home and found out what you'd done?"
2005,273,eleven minutes,Paulo Coelho,2005,http://books.google.com/books/content?id=Qp0EZu3GCYsC&printsec=frontcover&img=1&zoom=1&source=gbs_api,fiction,7,25,,"Eleven Minutes is the story of Maria, a young girl from a Brazilian village, whose first innocent brushes with love leave her heartbroken. At a tender age, she becomes convinced that she will never find true love, instead believing that ""love is a terrible thing that will make you suffer. . . ."" A chance meeting in Rio takes her to Geneva, where she dreams of finding fame and fortune. Maria's despairing view of love is put to the test when she meets a handsome young painter. In this odyssey of self-discovery, Maria has to choose between pursuing a path of darkness -- sexual pleasure for its own sake -- or risking everything to find her own ""inner light"" and the possibility of sacred sex, sex in the context of love. This P.S. edition features an extra 16 pages of insights into the book, including author interviews, recommended reading, and more."
2006,540,zen and the art of motorcycle maintenance,Robert M. Pirsig,2006,http://books.google.com/books/content?id=KMRReyLPyXMC&printsec=frontcover&img=1&zoom=1&source=gbs_api,psychology,12,25,,"One of the most important and influential books written in the past half-century, Robert M. Pirsig's Zen and the Art of Motorcycle Maintenance is a powerful, moving, and penetrating examination of how we live . . . and a breathtaking meditation on how to live better. Here is the book that transformed a generation: an unforgettable narration of a summer motorcycle trip across America's Northwest, undertaken by a father and his young son. A story of love and fear -- of growth, discovery, and acceptance -- that becomes a profound personal and philosophical odyssey into life's fundamental questions, this uniquely exhilarating modern classic is both touching and transcendent, resonant with the myriad confusions of existence . . . and the small, essential triumphs that propel us forward."
2004,176,ulysses s. grant,Michael Korda,2004,http://books.google.com/books/content?id=rvaqxQEACAAJ&printsec=frontcover&img=1&zoom=1&source=gbs_api,biography & autobiography,4,28,,"One of the first two volumes in Harper's Eminent Lives series, Korda brings his acclaimed storytelling talents to the life of Ulysses S. Grant – a man who managed to end the Civil War on a note of grace, serve two terms as president, write one of the most successful military memoirs in American literature, and is today remembered as a brilliant general but a failed president. Ulysses S. Grant was the first officer since George Washington to become a four–star general in the United States Army, and the only president between Andrew Jackson and Woodrow Wilson to serve eight consecutive years in the White House. In this succinct and vivid biography, Michael Korda considers Grant's character and reconciles the conflicting evaluations of his leadership abilities. Grant's life played out as a true Horatio Alger story. Despite his humble background as the son of a tanner in Ohio, his lack of early success in the army, and assorted failed business ventures, his unwavering determination propelled him through the ranks of military leadership and into the presidency. But while the general's tenacity and steadfastness contributed to his success on the battlefield, it both aided and crippled his effectiveness in the White House. Assessing Grant both within the context of his time and in contrast to more recent American leaders, Korda casts a benevolent eye on Grant's presidency while at the same time conceding his weaknesses. He suggests that though the general's second term ended in financial and political scandals, the fact remains that for eight years Grant exerted a calming influence on a country that had only just emerged from a horrendous civil war. Ulysses S. Grant is an even–handed and stirring portrait of a man who guided America through a pivotal juncture in its history."
2006,387,a dirty job,Christopher Moore,2006,http://books.google.com/books/content?id=W8EPgwEP_hoC&printsec=frontcover&img=1&zoom=1&source=gbs_api,fiction,15,23,,"Charlie Asher is a pretty normal guy. A little hapless, somewhat neurotic, sort of a hypochondriac. He's what's known as a Beta Male: the kind of fellow who makes his way through life by being careful and constant -- you know, the one who's always there to pick up the pieces when the girl gets dumped by the bigger/taller/stronger Alpha Male. But Charlie's been lucky. He owns a building in the heart of San Francisco, and runs a secondhand store with the help of a couple of loyal, if marginally insane, employees. He's married to a bright and pretty woman who actually loves him for his normalcy. And she, Rachel, is about to have their first child. Yes, Charlie's doing okay for a Beta. That is, until the day his daughter, Sophie, is born. Just as Charlie -- exhausted from the birth -- turns to go home, he sees a strange man in mint-green golf wear at Rachel's hospital bedside, a man who claims that no one should be able to see him. But see him Charlie does, and from here on out, things get really weird. . . . People start dropping dead around him, giant ravens perch on his building, and it seems that everywhere he goes, a dark presence whispers to him from under the streets. Strange names start appearing on his nightstand notepad, and before he knows it, those people end up dead, too. Yup, it seems that Charlie Asher has been recruited for a new job, an unpleasant but utterly necessary one: Death. It's a dirty job. But hey, somebody's gotta do it. Christopher Moore, the man whose Lamb served up Jesus' ""missing years"" (with the funny parts left in), and whose Fluke found the deep humor in whale researchers' lives, now shines his comic light on the undiscovered country we all eventually explore -- death and dying -- and the results are hilarious, heartwarming, and a hell of a lot of fun."
2004,927,quicksilver,Neal Stephenson,2004,http://books.google.com/books/content?id=Qf1AlwEACAAJ&printsec=frontcover&img=1&zoom=1&source=gbs_api,fiction,8,30,,"Quicksilver is the story of Daniel Waterhouse, fearless thinker and conflicted Puritan, pursuing knowledge in the company of the greatest minds of Baroque-era Europe, in a chaotic world where reason wars with the bloody ambitions of the mighty, and where catastrophe, natural or otherwise, can alter the political landscape overnight. It is a chronicle of the breathtaking exploits of ""Half-Cocked Jack"" Shaftoe -- London street urchin turned swashbuckling adventurer and legendary King of the Vagabonds -- risking life and limb for fortune and love while slowly maddening from the pox. And it is the tale of Eliza, rescued by Jack from a Turkish harem to become spy, confidante, and pawn of royals in order to reinvent Europe through the newborn power of finance. A gloriously rich, entertaining, and endlessly inventive novel that brings a remarkable age and its momentous events to vivid life, Quicksilver is an extraordinary achievement from one of the most original and important literary talents of our time. And it's just the beginning ..."
2006,400,every book its reader,Nicholas A. Basbanes,2006,http://books.google.com/books/content?id=o4K_KMO1DWUC&printsec=frontcover&img=1&zoom=1&source=gbs_api,literary criticism,4,21,,"Inspired by a landmark exhibition mounted by the British Museum in 1963 to celebrate five eventful centuries of the printed word, Nicholas A. Basbanes offers a lively consideration of writings that have ""made things happen"" in the world, works that have both nudged the course of history and fired the imagination of countless influential people. In his fifth work to examine a specific aspect of book culture, Basbanes also asks what we can know about such figures as John Milton, Edward Gibbon, John Locke, Isaac Newton, Samuel Taylor Coleridge, John Adams, Frederick Douglass, Abraham Lincoln, Henry James, Thomas Edison, Helen Keller––even the notorious Marquis de Sade and Adolf Hitler––by knowing what they have read. He shows how books that many of these people have consulted, in some cases annotated with their marginal notes, can offer tantalizing clues to the evolution of their character and the development of their thought."
2005,384,flirting with danger,Suzanne Enoch,2005,http://books.google.com/books/content?id=c5DcXFV6Xm4C&printsec=frontcover&img=1&zoom=1&source=gbs_api,fiction,6,29,,"In her dazzling romantic suspense debut, USA Today bestselling author Suzanne Enoch brings us a thrilling tale about a thief who needs to prove she's no murderer and the millionaire who loves her. Samantha Jellicoe is a thief and proud of it. Raised to appreciate the finer things in life, Sam has no trouble divesting the wealthy of their treasures. This all changed, however, the night she attempts to steal a valuable item from a Palm Beach estate. Before she knew what hit her, a bomb goes off, a guard is killed, and Sam ends up saving millionaire Richard Addison. She's a good thief and will own up to her jobs, but if anyone thinks to tie her to murder, they better think again. On any other night, having a one hundred plus pounds of female fling herself at you is a good thing. But on this particular night, Richard Addison is mad as hell. Not only did he just have his gallery blown up-with him about to enter it-but the woman who rescued him didn't stick around to offer any explanations. When the dust settles, Rick knows the only person with answers to his questions is the mystery woman. And if she thinks she can hide from him, she better think again."
2004,241,lost horizon,James Hilton,2004,http://books.google.com/books/content?id=QD1s4c3EHgUC&printsec=frontcover&img=1&zoom=1&source=gbs_api,fiction,8,20,,"Following a plane crash in the Himalayan mountains, a lost group of Englishmen and Americans stumble upon the dream-like, utopian world of Shangri-La, where life is eternal and civilization refined, in a new trade paperback edition of the classic 1933 novel. Reprint."
2004,187,the doors of perception and heaven and hell,Aldous Huxley,2004,http://books.google.com/books/content?id=rz3NJb2-9_IC&printsec=frontcover&img=1&zoom=1&source=gbs_api,philosophy,15,30,,"The acclaimed novelist and critic describes his personal experimentation with the little-known drug mescaline and explores the nature of visionary experience, in an omnibus edition containing the two classic works The Doors of Perception and Heaven and Hell. Reissue."
2006,228,thanksgiving,Janet Evanovich,2006,http://books.google.com/books/content?id=O-t1GwAACAAJ&printsec=frontcover&img=1&zoom=1&source=gbs_api,fiction,10,23,,"When Megan Murphy discovered a floppy-eared rabbit gnawing on the hem of her skirt, she meant to give its careless owner a piece of her mind, but Dr. Patrick Hunter was too attractive to stay mad at for long. Soon the two are making Thanksgiving dinner for their families."
2005,244,love overboard,Janet Evanovich,2005,http://books.google.com/books/content?id=5pClJ0BTE2gC&printsec=frontcover&img=1&zoom=1&source=gbs_api,fiction,1,30,,"Dear Reader: In a previous life, before the time of Plum, I wrote twelve short romance novels. Red-hot screwball comedies, each and every one of them. Nine of these stories were originally published by the Loveswept line between the years 1988 and 1992. All went out-of-print immediately and then could be found only at used bookstores and yard sales. I'm excited to tell you that those nine stories are now being re-released by HarperCollins. Love Overboard is second in the lineup, and it's presented here in almost original form. I've done only minor editing to correct some embarrassing bloopers missed the first time around. And I changed the title because I thought the original title (Ivan Takes a Wife) was boring! Love Overboard is a romantic tale about a handsome ship's captain; a wary wench from Jersey City; a hundred-year-old, two-masted schooner; and an entire town of shoemakers. There's some getting naked, some blueberry pie, more getting naked, and at the end . . . Okay, I won't tell you about the end, but it's really good and it'll make you feel happy. I took my family on the road trip from heck to research this book. When we finally got to Maine it was all worthwhile because we fell in love with the boats and the people who sailed them. Enjoy!"
2005,234,back to the bedroom,Janet Evanovich,2005,http://books.google.com/books/content?id=fcPjlwEACAAJ&printsec=frontcover&img=1&zoom=1&source=gbs_api,fiction,9,29,,"Dear Reader: In a previous life, before the time of Plum, I wrote twelve short romance novels. Red-hot screwball comedies, each and every one of them. Nine of these stories were originally published by the Loveswept line between the years 1988 and 1992. All immediately went out of print and could be found only at used bookstores and yard sales. I'm excited to tell you that those nine stories are now being re-released by HarperCollins. Back to the Bedroom is presented here in almost original form. I've done only minor editing to correct some embarrassing bloopers missed the first time around. I lived in northern Virginia when I wrote Back to the Bedroom. My children were young, and we spent a lot of time visiting the Washington, D.C. museums and wandering through the historic neighborhoods. One day while strolling Capitol Hill I came upon two townhouses that captured my imagination. The houses were totally different -- a birthday cake of a house and a bran muffin of a house, and yet they shared a common wall. I wondered about the people who lived inside the houses. And eventually the houses inspired Back to the Bedroom. Back to the Bedroom is the story of a young woman with the soul of a birthday cake living in a bran muffin house -- and a nice-looking guy with the substance of a bran muffin living in a birthday cake. They share some misadventures, some romantic moments, some misunderstandings, and ultimately they turn into wedding cake. And for Plum fans, you'll be interested to find that this was the first of the four romances to feature Elsie Hawkins, the prototype for Grandma Mazur. Janet Evanovich"
2004,249,the rocky road to romance,Janet Evanovich,2004,http://books.google.com/books/content?id=b42OAHDzYqUC&printsec=frontcover&img=1&zoom=1&source=gbs_api,fiction,12,22,,"Her tall, dark, and deliciously dangerous boss . . . When the delightful, daffy Dog Lady of station WZZZ offered to take on the temporary job of traffic reporter, Steve Crow tried to think of reasons to turn Daisy Adams down. Perhaps he knew that sharing the close quarters of a car with her for hours would give the handsome program director no room to resist her quirky charms. He'd always favored low-slung sportscars and high-heeled women, but that was before he fell for a free spirit who caught crooks by accident, loved old people and pets, and had just too many jobs! Loving Daisy turned Steve's life upside down, especially once he adopted Bob, a huge dog masquerading as a couch potato. But was Daisy finally ready to play for keeps?"
2005,188,thomas jefferson,Christopher Hitchens,2005,http://books.google.com/books/content?id=zV8P_3E1OCIC&printsec=frontcover&img=1&zoom=1&source=gbs_api,biography & autobiography,10,22,,"In this unique biography of Thomas Jefferson, leading journalist and social critic Christopher Hitchens offers a startlingly new and provocative interpretation of our Founding Father. Situating Jefferson within the context of America's evolution and tracing his legacy over the past two hundred years, Hitchens brings the character of Jefferson to life as a man of his time and also as a symbolic figure beyond it. Conflicted by power, Jefferson wrote the Declaration of Independence and acted as Minister to France yet yearned for a quieter career in the Virginia legislature. Predicting that slavery would shape the future of America's development, this professed proponent of emancipation elided the issue in the Declaration and continued to own human property. An eloquent writer, he was an awkward public speaker; a reluctant candidate, he left an indelible presidential legacy. Jefferson's statesmanship enabled him to negotiate the Louisiana Purchase with France, doubling the size of the nation, and he authorized the Lewis and Clark expedition, opening up the American frontier for exploration and settlement. Hitchens also analyzes Jefferson's handling of the Barbary War, a lesser-known chapter of his political career, when his attempt to end the kidnapping and bribery of Americans by the Barbary states, and the subsequent war with Tripoli, led to the building of the U.S. navy and the fortification of America's reputation regarding national defense. In the background of this sophisticated analysis is a large historical drama: the fledgling nation's struggle for independence, formed in the crucible of the eighteenth-century Enlightenment, and, in its shadow, the deformation of that struggle in the excesses of the French Revolution. This artful portrait of a formative figure and a turbulent era poses a challenge to anyone interested in American history -- or in the ambiguities of human nature."
2006,256,muhammad,Karen Armstrong,2006,http://books.google.com/books/content?id=JUz3Z0iv_pgC&printsec=frontcover&img=1&zoom=1&source=gbs_api,biography & autobiography,13,24,,"Muhammad was born in 570 CE, and over the following sixty years built a thriving spiritual community, laying the foundations of a religion that changed the course of world history. There is more historical data on his life than on that of the founder of any other major faith, and yet his story is little known. Karen Armstrong's immaculately researched new biography of Muhammad will enable readers to understand the true origins and spirituality of a faith that is all too often misrepresented as cruel, intolerant, and inherently violent. An acclaimed authority on religious and spiritual issues, Armstrong offers a balanced, in-depth portrait, revealing the man at the heart of Islam by dismantling centuries of misconceptions. Armstrong demonstrates that Muhammad's life—a pivot point in history—has genuine relevance to the global crises we face today."
