description,num_pages,book_Title,Book_Author,year_of_Publication,image,categoryname,price,inStock,category
work subtitle make clear unfinished sketch philosophical investigation possibly important influential philosophical work modern time blue book set note dictated witgensteins cambridge student 19331934 brown book draft eventually became growth first part philosophical investigation book reveals germination growth idea found final expression witgensteins later work indispensable therefore student witgensteins thought wish study firsthand mental process thinker fundamentally changed course modern philosophy,208,the blue and brown books,ludwig wittgenstein,1965,http://books.google.com/books/content?id=ffiZugEACAAJ&printsec=frontcover&img=1&zoom=1&source=gbs_api,philosophy,2938,22,
astounding yet true ragstoriches saga homeless father raised cared son mean street san francisco went become crown prince wall street age twenty milwaukee native chris gardner navy arrived san francisco pursue promising career medicine considered prodigy scientific research surprised everyone setting sight competitive world high finance yet sooner landed entrylevel position prestigious firm gardner found caught web incredibly challenging circumstance left part city working homeless toddler son motivated promise made fatherless child never abandon child two spent almost year moving among shelter hotel soup line even sleeping public restroom subway station never giving despair gardner made astonishing transformation part city invisible poor powerful player financial district memoir gardner financial success story man break family cycle men abandoning child mythic triumphant unstintingly honest pursuit happyness conjures hero like horatio alger antwone fisher appeal essence american dream,,the pursuit of happyness,chris gardner,2009,http://books.google.com/books/content?id=xUVtpmQZlZUC&printsec=frontcover&img=1&zoom=1&edge=curl&source=gbs_api,biography & autobiography,1014,25,
one bachelor three go four desirable gentleman wagered one shilling apiece bottle cognac go last unmarried man standing nigel cavendish know hell marry one day hopefully day many yearsand many womenin future handsome unrepentant rake intends enjoy life pleasure fullest moment lady felicity melville spy adventurous scoundrel climbing neighbor windowwith comely conquest husband hot pursuitshe know nigel answer prayer little reformation course felicity craves excitement london exciting infamous mr cavendish whats girl hatch scheme win fervently desire plan work well game chance errant pistol shot abruptly make husband wifebut way neither wanted felicity prove wayward husband shes woman could ever want need,,what a lady wants,victoria alexander,2009,http://books.google.com/books/content?id=ms8Sxy_sfEEC&printsec=frontcover&img=1&zoom=1&source=gbs_api,fiction,1131,25,
last unmarried man standing man right mind would want get married every duke earl viscount know fellow must duty end four london desirable gentleman make wagerthe prize going one remains unwed longest gideon pearsall viscount warton think fair shot winning he managed enjoy favor many lady resisting parson noose even he stopped dead track scandalous woman londonjudith lady chesterhe vow bedded never wedded beautiful little bit naughty judith always kept within bound respectability even playing rule experience taught avoid marriage desire resist wartons hot kiss tempting touch impossible ignore soon judith gideon cant help wonder possible little bit wicked still follow heart,,a little bit wicked,victoria alexander,2009,http://books.google.com/books/content?id=KPM0TYF7DNgC&printsec=frontcover&img=1&zoom=1&edge=curl&source=gbs_api,fiction,2071,22,
extremely entertaining compendium bon mot anecdote trivia winston churchill leading churchill lecturer performer useful speaker student history world war ii buff well general reader,,the wit and wisdom of winston churchill,james c. humes,2009,http://books.google.com/books/content?id=00d_C6Yf9m0C&printsec=frontcover&img=1&zoom=1&edge=curl&source=gbs_api,history,1058,25,
sweet delight chocolat heady concoction blackberry wine tart pleasure five quarter orange bestselling author joanne harris wrote sleep pale sister gothic tourdeforce recall powerfully dark sensibility novel holy fool originally published 1994 never available united state sleep pale sister hypnotically atmospheric story set nineteenth century london puritanical artist henry chester see delicate child beauty effie make favorite model long bride henry volatile repressed love ideal passive docile asexual woman project onto effie far woman really effie begin discover murderous depth henry hypocrisy latent passion rise surface sleep pale sister combine ethereal beauty preraphaelite painting chilling high gothic tale testament harris brimming cornucopia talent p edition feature extra 16 page insight book including author interview recommended reading,,"sleep, pale sister",joanne harris,2009,http://books.google.com/books/content?id=BLSAth-7Re8C&printsec=frontcover&img=1&zoom=1&edge=curl&source=gbs_api,fiction,1981,23,
omnibus cover nikki giovannis complete work poetry 19671983 collected poetry nikki giovanni include complete volume five adult book poetry black feeling black talkblack judgement house woman men cotton candy rainy day ride night wind nikki selfpublished first book black feeling black talkblackjudgement 1969 selling 10000 copy william morrow published 1970 know iconic revolutionary phrase heralded one important volume modern africanamerican poetry considered seminal volume nikkis body work house morrow 1972 mark new dimension tone philosphythis giovannis first foray autobiographical woman men morrow 1975 nikki display compassion people thing place encounteredshe revere ordinary search extraordinary cotton candy rainy day morrow 1978 one poignant introspective giovannis collection poem chronicle drastic change took place 1970swhen dream civil right era seemed evaporated ride night wind morrow 1983 devoted day tripper midnight cowboy one devoted life pushing limit human condition shattered constraint stautus quo,,the collected poetry of nikki giovanni,nikki giovanni,2009,http://books.google.com/books/content?id=nCgrT6bx0Y8C&printsec=frontcover&img=1&zoom=1&edge=curl&source=gbs_api,poetry,2651,24,
sugarplum scandal brings together best romance mystery one delightful collection christmas tale expert hand six avon best storyteller holiday season take air love scandalous surprise filled christmas miracle romance suspense make perfect gift romance mystery fan author brings unique voice character collection well fan following want christmas two front teeth lori avocato lord misrule dana cameron ghost christmas passed mary daheim partner crime cait london holly go lightly suzanne macpherson vampy christmas kerrelyn spark,,sugarplums and scandal,dana cameron;mary daheim;lori avocato;kerrelyn sparks;suzanne macpherson;cait london,2010,http://books.google.com/books/content?id=hcTOj-A6C70C&printsec=frontcover&img=1&zoom=1&edge=curl&source=gbs_api,fiction,1626,30,
lively insider guide starting successful small business selling item old new ebay written personal anecdote wellkept secret insider tip adam ginsberg ebays successful private salesperson insider guide making money ebay adam ginsberg successful seller ebay moving around million dollar worth merchandise every month impart personal secret sell ebay learned year experience tip expanding small business using ebay global market hell also give fun sidenotes anecdote keeping book lively making fun interesting read book musthave current aspiring ebay seller smallbusiness owner anyone want learn start milliondollar company,,"how to buy, sell, and profit on ebay",adam ginsberg,2010,http://books.google.com/books/content?id=eNq_KlqjJdwC&printsec=frontcover&img=1&zoom=1&edge=curl&source=gbs_api,business & economics,2664,27,
bestselling author show reclaim make peace shadow side personality,118,owning your own shadow,robert a. johnson,1993,http://books.google.com/books/content?id=mLc9X3QCkR8C&printsec=frontcover&img=1&zoom=1&source=gbs_api,self-help,1331,26,
provides introduction hinduism buddhism confucianism taoism islam judaism christianity native tradition america australia africa oceania,416,the world's religions,huston smith,1991,http://books.google.com/books/content?id=eDMIwLHwKOcC&printsec=frontcover&img=1&zoom=1&source=gbs_api,history,2729,21,
vivid detailed biography strip away century distortion myth present balanced view man whose religion continues dramatically affect course history,304,muhammad,karen armstrong,1993,http://books.google.com/books/content?id=FbDVDnPRXKoC&printsec=frontcover&img=1&zoom=1&source=gbs_api,biography & autobiography,1329,21,
essence perennial stoic wisdom aphorism stunning insight simplicity west first best little instruction book offer thoroughly contemporary pragmatic reflection best live serenity joy,96,a manual for living,epictetus,1994,http://books.google.com/books/content?id=cofP7FbBfAgC&printsec=frontcover&img=1&zoom=1&source=gbs_api,religion,1130,21,
previously published diary magus book tell coelhos initiation spiritual path leading inner development wisdom share exercise selfcontrol selfdiscovery taught pilgrimage along ancient road santiago,272,the pilgrimage,paulo coelho;alan r. clarke,1995,http://books.google.com/books/content?id=atdJcAL3MBQC&printsec=frontcover&img=1&zoom=1&source=gbs_api,fiction,1482,22,
magical tale forgiving past believing future enchanting true story valkyrie begin rio de janeiro author paulo coelho give mysterious master j manuscript book alchemist haunted devastating curse coelho confesses j ive seen dream fall apart seemed achieve response j give coelho daunting task must find speak guardian angel curse broken reply complete task rising challenge paulo wife cristina drop everything pack bag take forty day adventure starkly beautiful sometimes dangerous mojave desert encounter bargained masterful blend exotic locale dramatic adventure magical storytelling coelhos fictional work renowned truelife account modernday adventure metaphysical odyssey,212,the valkyries,paulo coelho,1996,http://books.google.com/books/content?id=jMT_h99Z_lUC&printsec=frontcover&img=1&zoom=1&source=gbs_api,fiction,2864,30,
rainforest healing home garden find alternative chemical antidepressant painkiller spice rack learn natural antiitch salve insect bite soothe relieve envy grief sadness fear maya way rid house negative energy maya cleansing ritual try easytomake bronchitis remedy,221,rainforest home remedies,rosita arvigo;nadine epstein,2001,http://books.google.com/books/content?id=DLnwOX0FlYEC&printsec=frontcover&img=1&zoom=1&source=gbs_api,health & fitness,1952,24,
journal share fruitful reflection life career prompted author visit personal place retreat near country home,246,a circle of quiet,madeleine l'engle,1984,http://books.google.com/books/content?id=0r6LtMCHH3wC&printsec=frontcover&img=1&zoom=1&source=gbs_api,religion,2413,26,
beautiful gift edition thomas bulfinchs classic retelling famous myth folk legend interpretive essay princeton classic professor richard p martin,768,bulfinch's mythology,richard p. martin,1991,http://books.google.com/books/content?id=eev4uAEACAAJ&printsec=frontcover&img=1&zoom=1&source=gbs_api,reference,2367,30,
study influence romanticism exerts upon western culture,416,romanticism,hugh honour,1979,http://books.google.com/books/content?id=BsJHmQEACAAJ&printsec=frontcover&img=1&zoom=1&source=gbs_api,art,2079,27,
best friend forever lot child hill street little girl betsys age new family move house across street betsy hope little girl play sure enough doa little girl named tacy moment meet betsys fifth birthday party betsy tacy becoms good friend everyone start think one personbetsytacy betsy tacy lot fun together make playhouse piano box sand store dress go calling one day come home wonderful surprisea new friend named tib ever since first publication 1940s betsytacy story loved generation young reader,144,betsy-tacy,maud hart lovelace,1993,http://books.google.com/books/content?id=tfUCGyIfJzsC&printsec=frontcover&img=1&zoom=1&source=gbs_api,fiction,2601,25,
betsy tacy tib cant wait ten getting two number age beginning growing upexciting thing bound happen girl fall love king spain perform school entertainment first time go way big hill little syria betsy tacy tib make new friend learn thing two learn new american sometimes best american learn wouldnt want anything else ever since first publication 1940s betsytacy story loved generation young reader,192,betsy and tacy go over the big hill,maud hart lovelace,1993,http://books.google.com/books/content?id=iJSAmAEACAAJ&printsec=frontcover&img=1&zoom=1&source=gbs_api,fiction,1127,25,
novel active life two rather different high school freshman 1906,368,heaven to betsy,maud hart lovelace,1945,http://books.google.com/books/content?id=q3H5yAEACAAJ&printsec=frontcover&img=1&zoom=1&source=gbs_api,fiction,2612,28,
strange little man come coven tree church social promising give people exactly ask three young believersinmagic make wish come true unexpected way,192,the wish giver,bill brittain,1986,http://books.google.com/books/content?id=uYAY6WCsZgIC&printsec=frontcover&img=1&zoom=1&source=gbs_api,fiction,2539,24,
racso brash boastful little rodent making way thorn valley determined learn read write become hero bragging lie get bad start crisis give opportunity prove mettle worthy successor mr frisby rat nimh newbery medal winner author father bl 1986 childrens editor choice bl childrens choice 1987 iracbc notable 1986 childrens trade book social study ncsscbc 1986 childrens book ny public library best science fictionfantasy 1986 voya,288,racso and the rats of nimh,jane leslie conly,1988,http://books.google.com/books/content?id=MgoNv0g8pskC&printsec=frontcover&img=1&zoom=1&source=gbs_api,fiction,1870,28,
twelveyearold casey waiting day barney father hit big cause horse come tell penthouse suite hr end hospital casey sent chinatown live grandmother pawpaw waiting seems longer ever casey feel lost chinatown shes prepared chinese school noisy crowd missing father pawpaw tell mother casey never knew family owl charm true chinese name casey last begin understand pawpaw chinatown home parent home hometoo,288,child of the owl,laurence yep,1990,http://books.google.com/books/content?id=IvP2bGRcViQC&printsec=frontcover&img=1&zoom=1&source=gbs_api,fiction,2677,26,
margaret younger brother artie get lost wood family camping trip rescued rat superintelligent rat nimh taken rat community child safe time winter coming margaret artie get back home must protect rat helped everything depends silence hard evade question forever childrens choice 1991 iracbcvoyas best science fiction fantasy horror 1990parenting honorable mention reading magic award,272,"r-t, margaret, and the rats of nimh",jane leslie conly,1991,http://books.google.com/books/content?id=WTHHHA80Q_oC&printsec=frontcover&img=1&zoom=1&source=gbs_api,fiction,1263,23,
culled 69 story collected 1930s wpa project 20 tale organized section theme like trickster virtue vice thoughtful introduction placing individual story context feeling background original teller yeps telling vigorous often poetic imbued earthy humor realism touched fatalism handsomely designed collection k notable childrens book 1989 ala usa childrens book 1990 ala 1989 boston globehorn book award nonfiction 1990 fanfare honor list horn book 1989 childrens editor choice bl notable 1989 childrens trade book social study ncsscbc childrens book 1989 library congress 1989 childrens book ny public library best book 1989 parent magazine,208,the rainbow people,laurence yep,1992,http://books.google.com/books/content?id=5AHwqNDuiCwC&printsec=frontcover&img=1&zoom=1&source=gbs_api,fiction,2710,20,
1867 otter travel three willow village china california land golden mountain join father uncle spite presence family otter stranger among chinese new land expected see land goldfield see vast cold whiteness otter dream learn take technology back middle kingdom free china manchu invader otter others board machine change life train would open dragon gate,352,dragon's gate,laurence yep,1995,http://books.google.com/books/content?id=7_8vo34TfMQC&printsec=frontcover&img=1&zoom=1&source=gbs_api,fiction,2258,24,
betsy marries joe high school sweetheart problem young newlywed sixtieth anniversary edition beloved story includes new biographical section new forward original,260,betsy's wedding,maud hart lovelace,1996,http://books.google.com/books/content?id=aT6r0nSbMG8C&printsec=frontcover&img=1&zoom=1&source=gbs_api,fiction,1139,26,
january 1914 unsuccessful college experience broken romance joe behind twentyoneyearold betsy traveling alone first time determines enjoy every moment long trip around europe,321,betsy and the great world,maud hart lovelace,1996,http://books.google.com/books/content?id=Vu1h2B2XoHoC&printsec=frontcover&img=1&zoom=1&source=gbs_api,fiction,2390,20,
small town shortly turn century provides background account betsys third year deep valley high reissue,320,betsy was a junior,maud hart lovelace,1995,http://books.google.com/books/content?id=TNcQQCH_NMgC&printsec=frontcover&img=1&zoom=1&source=gbs_api,fiction,1894,29,
increasingly alienated widowed father vernon join friend ridiculing neighborhood outcastsmaxine alcoholic prone outrageous behavior ronald retarded son social service agency try put ronald special home vernon fight move 1994 newbery honor book notable childrens book 1994 ala 1994 best book young adult ala 1994 young adult editor choice bl 1994 book teen age ny public library young adult choice 1995 ira,192,crazy lady!,jane leslie conly,1995,http://books.google.com/books/content?id=aJwh7yxnoMoC&printsec=frontcover&img=1&zoom=1&source=gbs_api,fiction,2378,30,
land hardship strawberry big ripe juicy tenyearold birdie boyer hardly wait start picking family moved florida backwoods havent even begun planting dont count biddy fore theyre hatched gal young un father tell making new farm prosper easy heat suffer drought cold snap perhaps worrisome boyers rowdy neighbor itching start feud,208,strawberry girl 60th anniversary edition,lois lenski,1995,http://books.google.com/books/content?id=AQXM28er0HUC&printsec=frontcover&img=1&zoom=1&source=gbs_api,fiction,1700,23,
seven siberian snow spider frozen ice age defrost escape en route harvard analysis wreak havoc small new england town disrupting school halloween pageant hilarious result ala notable childrens book reissue,144,seven spiders spinning,gregory maguire,1995,http://books.google.com/books/content?id=VPf_uAEACAAJ&printsec=frontcover&img=1&zoom=1&source=gbs_api,fiction,2477,25,
includes short story poem excerpt play relate like growing asian american,256,american dragons,laurence yep,1995,http://books.google.com/books/content?id=-NZzW8s9EMwC&printsec=frontcover&img=1&zoom=1&source=gbs_api,fiction,1611,24,
like cushmans 1995 newbery honor book catherine called birdy novel strong young woman medieval england find way home world like chaucer thats dangerous primitive raucous first page youre caught spirit homeless nameless waif somewhere around 12 year old get village midwife take befriends cat name alyce learns something delivering baby fails run away pick return work independence ala booklist starred review fascinating view far distant time horn book starred review,128,the midwife's apprentice (rpkg),karen cushman,1996,http://books.google.com/books/content?id=Bhm76u8ZcHMC&printsec=frontcover&img=1&zoom=1&source=gbs_api,fiction,1219,21,
little house book tell story little pioneer girl family traveled covered wagon across midwest laura ingalls wilder classic book illustrated garth williams timeless artwork cherished million reader ever since first published sixty year ago first little house book introduces almanzo wilder young boy farmer boy would one day marry laura ingalls winter farm almanzo go afternoon barn chore sits eat hearty farm supper family first book almanzo young reader able share warmth joy another little house family celebrate new little house adventure winter farm first ongoing series lauras beloved farmer boy,32,winter on the farm,laura ingalls wilder,1997,http://books.google.com/books/content?id=IvlKH7fq3-MC&printsec=frontcover&img=1&zoom=1&source=gbs_api,fiction,1909,23,
arrival new governess miss crow martha begin see work quite important soon realizes could learn great deal took time get know simultaneous,321,down to the bonny glen,melissa wiley,2001,http://books.google.com/books/content?id=nO5OGr8anJ8C&printsec=frontcover&img=1&zoom=1&source=gbs_api,fiction,1548,22,
fade interior early morning cell block manhattan detention center steve voiceover sometimes feel like walked middle movie maybe make movie film story life life experience ill call lady prosecutor called monster,281,monster,walter dean myers,2001,http://books.google.com/books/content?id=se3BugEACAAJ&printsec=frontcover&img=1&zoom=1&source=gbs_api,fiction,2069,27,
graduating high school emily webster longs go university everyone else must stay home take care grandfather civil war veteran home discovers many new adventure reprint,304,emily of deep valley,maud hart lovelace,2000,http://books.google.com/books/content?id=8uT9_Io3bYwC&printsec=frontcover&img=1&zoom=1&source=gbs_api,fiction,1564,24,
swan song like rest family louis trumpeter swan unlike four brother sister louis cant trumpet joyfully fact cant even make sound since cant trumpet love beautiful swan serena pay absolutely attention louis try everything think win serenas affection even go school learn read write nothing seems work father steal real brass trumpet musical instrument key winning louis love,252,the trumpet of the swan,e. b. white,2000,http://books.google.com/books/content?id=2lybT5x8FCsC&printsec=frontcover&img=1&zoom=1&source=gbs_api,fiction,2344,20,
old man living united state marcel recall childhood germanoccupied france especially summer older brother rent befriended young german soldier reprint,144,the good liar,gregory maguire,2002,http://books.google.com/books/content?id=NLBPD7kd5YQC&printsec=frontcover&img=1&zoom=1&source=gbs_api,fiction,1863,20,
grasshopper ruin crop eightyearold laura ingalls family leave plum creek move burr oak iowa experience life small town help manage hotel reprint,176,old town in the green groves,cynthia rylant;jim lamarche,2004,http://books.google.com/books/content?id=YUQMAXdqvhgC&printsec=frontcover&img=1&zoom=1&source=gbs_api,fiction,1837,23,
land ingary thing spell invisible cloak sevenleague boot everyday thing witch waste another matter fifty year quiet rumored witch terrorize country moving black castle blowing dark smoke four thin turret appeared horizon everyone thought witch castle however belonged wizard howl said liked suck soul young girl hatter sisterssophie lettie marthaand girl warned venture street alone beginning giant jigsaw puzzle fantasy people thing never quite seem destiny intertwined identity exchanged lover confused witch placed spell howl clue breaking lie famous poem happen sophie hatter enters howl castle diana wynne jones entrancing fantasy filled surprise every turn final stormy duel witch wizard finished piece fall magically place,329,howl's moving castle,diana wynne jones,2001,http://books.google.com/books/content?id=f3RHPfF7uCwC&printsec=frontcover&img=1&zoom=1&source=gbs_api,fiction,2412,30,
student scheme find love match beloved teacher valentine day turn comedy error four stupid cupid ancient greece try help,224,four stupid cupids,gregory maguire,2001,http://books.google.com/books/content?id=471OUKKACq8C&printsec=frontcover&img=1&zoom=1&source=gbs_api,fiction,1310,29,
beloved generation charlotte web stuart little two cherished story time first time ever treasured classic available lavish new collector edition addition larger trim size original blackandwhite art garth williams lovingly colorized renowned illustrator rosemary well adding another dimension two perfect book young old alike,184,charlotte's web (full color),e. b. white,2001,http://books.google.com/books/content?id=pylJbfNIwoIC&printsec=frontcover&img=1&zoom=1&source=gbs_api,fiction,2191,25,
laura ingalls share adventure good time friend growing western frontier,80,little house friends,heather henson;laura ingalls wilder,1998,http://books.google.com/books/content?id=gMZbAAfZwAIC&printsec=frontcover&img=1&zoom=1&source=gbs_api,fiction,2689,20,
gentle adaptation laura ingalls wilder celebrated little house story gathered together two new title little house chapter book series christmas story join laura family pioneer christmas celebration christmas frontier mean visit friend good thing eat present laura every christmas little house better one laura friend share wonderful adventure little house friend racing pony cousin lena bobsled ride cap garland gang laura love spending time friend even mean old nellie oleson cant spoil lauras funwith simple text entertaining story renee graefs beautiful blackandwhite artwork little house chapter book perfect way introduce beginning chapterbook reader world little house,80,christmas stories,laura ingalls wilder,1998,http://books.google.com/books/content?id=qJxFQDe9AP4C&printsec=frontcover&img=1&zoom=1&source=gbs_api,fiction,2828,23,
laura help pa make little log cabin snug cozy snowy day ahead 1994 pick list aba,32,winter days in the big woods,laura ingalls wilder,1995,http://books.google.com/books/content?id=H-igY69LTxcC&printsec=frontcover&img=1&zoom=1&source=gbs_api,fiction,1508,28,
