description,num_pages,book_Title,Book_Author,year_of_Publication,image,categoryname,price,inStock,category
alexandra barney barnaby roar onto miami beach scene hot pursuit missing baby brother wild bill leave maverick family get barney involved highspeed car chase search sunken treasure sam hooker nascar driver who good revving woman engine engaged deadly race bill borrowed hooker sixtyfivefoot hatteras sailed sunsetjust hooker plan boat hooker figure hell attach barney maybe run scumbag bill better yet maybe hell get lucky love bill sweetie pie sister pedal go metal barney hooker want first cross finish line save bill hooker boatand maybe world,374,metro girl,janet evanovich,2005,http://books.google.com/books/content?id=X0OYbJSjxqYC&printsec=frontcover&img=1&zoom=1&source=gbs_api,fiction,1769,25,
alexandra barney barnaby return take whole new set bad guy florida heat colorful dangerous character highstakes adventure romancing gorgeous race car driver sam hooker actionpacked sequel metro girl 1000000 first printing,312,motor mouth,janet evanovich,2006,http://books.google.com/books/content?id=mG5p4QA2zOwC&printsec=frontcover&img=1&zoom=1&source=gbs_api,fiction,2015,23,
child sean devine jimmy marcus dave boyle friend strange car pulled street one boy got car two something terrible happened something ended friendship changed three boy forever twentyfive year later sean homicide detective jimmy excon owns corner store dave trying hold marriage together keep demon bay demon urge terrible thing jimmy daughter found murdered sean assigned case investigation brings conflict jimmy find old criminal impulse tempt solve crime brutal justice dave came home night jimmy daughter died covered someone el blood tense unnerving psychological thriller mystic river also epic novel love loyalty faith family people irrevocably marked past find collision course darkest truth hidden self,416,mystic river,dennis lehane,2003,http://books.google.com/books/content?id=2U-ivgEACAAJ&printsec=frontcover&img=1&zoom=1&source=gbs_api,fiction,2208,21,
billy budd sailor bartleby scrivener two revered shorter work fiction history collected along 19 story beautifully redesigned collection represents best short work american masteras warner berthoff writes introduction volume hard think major novelist storyteller also firstrate entertainer master according choice high comedy one another robust specie expressive humour special variety preposterous grotesque absurd melville certainly exception kind vigorous supervisory humour natural idiom writer one particular attraction shorter work fresh display offer prime element literary character,512,great short works of herman melville,herman melville,2004,http://books.google.com/books/content?id=6WgbDCDIe-QC&printsec=frontcover&img=1&zoom=1&source=gbs_api,fiction,2366,28,
ill swap dad said ohoh said little sister wanted best friend two goldfish much youd swap anything even father mother came home found youd done,64,the day i swapped my dad for two goldfish,neil gaiman,2006,http://books.google.com/books/content?id=6EqMPwAACAAJ&printsec=frontcover&img=1&zoom=1&source=gbs_api,fiction,2173,23,
eleven minute story maria young girl brazilian village whose first innocent brush love leave heartbroken tender age becomes convinced never find true love instead believing love terrible thing make suffer chance meeting rio take geneva dream finding fame fortune maria despairing view love put test meet handsome young painter odyssey selfdiscovery maria choose pursuing path darkness sexual pleasure sake risking everything find inner light possibility sacred sex sex context love p edition feature extra 16 page insight book including author interview recommended reading,273,eleven minutes,paulo coelho,2005,http://books.google.com/books/content?id=Qp0EZu3GCYsC&printsec=frontcover&img=1&zoom=1&source=gbs_api,fiction,2629,28,
one important influential book written past halfcentury robert pirsigs zen art motorcycle maintenance powerful moving penetrating examination live breathtaking meditation live better book transformed generation unforgettable narration summer motorcycle trip across america northwest undertaken father young son story love fear growth discovery acceptance becomes profound personal philosophical odyssey life fundamental question uniquely exhilarating modern classic touching transcendent resonant myriad confusion existence small essential triumph propel u forward,540,zen and the art of motorcycle maintenance,robert m. pirsig,2006,http://books.google.com/books/content?id=KMRReyLPyXMC&printsec=frontcover&img=1&zoom=1&source=gbs_api,psychology,1922,30,
one first two volume harper eminent life series korda brings acclaimed storytelling talent life ulysses grant man managed end civil war note grace serve two term president write one successful military memoir american literature today remembered brilliant general failed president ulysses grant first officer since george washington become fourstar general united state army president andrew jackson woodrow wilson serve eight consecutive year white house succinct vivid biography michael korda considers grant character reconciles conflicting evaluation leadership ability grant life played true horatio alger story despite humble background son tanner ohio lack early success army assorted failed business venture unwavering determination propelled rank military leadership presidency general tenacity steadfastness contributed success battlefield aided crippled effectiveness white house assessing grant within context time contrast recent american leader korda cast benevolent eye grant presidency time conceding weakness suggests though general second term ended financial political scandal fact remains eight year grant exerted calming influence country emerged horrendous civil war ulysses grant evenhanded stirring portrait man guided america pivotal juncture history,176,ulysses s. grant,michael korda,2004,http://books.google.com/books/content?id=rvaqxQEACAAJ&printsec=frontcover&img=1&zoom=1&source=gbs_api,biography & autobiography,2068,29,
charlie asher pretty normal guy little hapless somewhat neurotic sort hypochondriac he whats known beta male kind fellow make way life careful constant know one who always pick piece girl get dumped biggertallerstronger alpha male charlies lucky owns building heart san francisco run secondhand store help couple loyal marginally insane employee he married bright pretty woman actually love normalcy rachel first child yes charlies okay beta day daughter sophie born charlie exhausted birth turn go home see strange man mintgreen golf wear rachel hospital bedside man claim one able see see charlie thing get really weird people start dropping dead around giant raven perch building seems everywhere go dark presence whisper street strange name start appearing nightstand notepad know people end dead yup seems charlie asher recruited new job unpleasant utterly necessary one death dirty job hey somebody gotta christopher moore man whose lamb served jesus missing year funny part left whose fluke found deep humor whale researcher life shine comic light undiscovered country eventually explore death dying result hilarious heartwarming hell lot fun,387,a dirty job,christopher moore,2006,http://books.google.com/books/content?id=W8EPgwEP_hoC&printsec=frontcover&img=1&zoom=1&source=gbs_api,fiction,1948,20,
quicksilver story daniel waterhouse fearless thinker conflicted puritan pursuing knowledge company greatest mind baroqueera europe chaotic world reason war bloody ambition mighty catastrophe natural otherwise alter political landscape overnight chronicle breathtaking exploit halfcocked jack shaftoe london street urchin turned swashbuckling adventurer legendary king vagabond risking life limb fortune love slowly maddening pox tale eliza rescued jack turkish harem become spy confidante pawn royal order reinvent europe newborn power finance gloriously rich entertaining endlessly inventive novel brings remarkable age momentous event vivid life quicksilver extraordinary achievement one original important literary talent time beginning,927,quicksilver,neal stephenson,2004,http://books.google.com/books/content?id=Qf1AlwEACAAJ&printsec=frontcover&img=1&zoom=1&source=gbs_api,fiction,1406,22,
inspired landmark exhibition mounted british museum 1963 celebrate five eventful century printed word nicholas basbanes offer lively consideration writing made thing happen world work nudged course history fired imagination countless influential people fifth work examine specific aspect book culture basbanes also asks know figure john milton edward gibbon john locke isaac newton samuel taylor coleridge john adam frederick douglas abraham lincoln henry james thomas edison helen kellereven notorious marquis de sade adolf hitlerby knowing read show book many people consulted case annotated marginal note offer tantalizing clue evolution character development thought,400,every book its reader,nicholas a. basbanes,2006,http://books.google.com/books/content?id=o4K_KMO1DWUC&printsec=frontcover&img=1&zoom=1&source=gbs_api,literary criticism,1399,30,
dazzling romantic suspense debut usa today bestselling author suzanne enoch brings u thrilling tale thief need prove shes murderer millionaire love samantha jellicoe thief proud raised appreciate finer thing life sam trouble divesting wealthy treasure changed however night attempt steal valuable item palm beach estate knew hit bomb go guard killed sam end saving millionaire richard addison shes good thief job anyone think tie murder better think night one hundred plus pound female fling good thing particular night richard addison mad hell gallery blown upwith enter itbut woman rescued didnt stick around offer explanation dust settle rick know person answer question mystery woman think hide better think,384,flirting with danger,suzanne enoch,2005,http://books.google.com/books/content?id=c5DcXFV6Xm4C&printsec=frontcover&img=1&zoom=1&source=gbs_api,fiction,2111,26,
following plane crash himalayan mountain lost group englishman american stumble upon dreamlike utopian world shangrila life eternal civilization refined new trade paperback edition classic 1933 novel reprint,241,lost horizon,james hilton,2004,http://books.google.com/books/content?id=QD1s4c3EHgUC&printsec=frontcover&img=1&zoom=1&source=gbs_api,fiction,1258,25,
acclaimed novelist critic describes personal experimentation littleknown drug mescaline explores nature visionary experience omnibus edition containing two classic work door perception heaven hell reissue,187,the doors of perception and heaven and hell,aldous huxley,2004,http://books.google.com/books/content?id=rz3NJb2-9_IC&printsec=frontcover&img=1&zoom=1&source=gbs_api,philosophy,2200,20,
megan murphy discovered floppyeared rabbit gnawing hem skirt meant give careless owner piece mind dr patrick hunter attractive stay mad long soon two making thanksgiving dinner family,228,thanksgiving,janet evanovich,2006,http://books.google.com/books/content?id=O-t1GwAACAAJ&printsec=frontcover&img=1&zoom=1&source=gbs_api,fiction,2140,22,
dear reader previous life time plum wrote twelve short romance novel redhot screwball comedy every one nine story originally published loveswept line year 1988 1992 went outofprint immediately could found used bookstore yard sale im excited tell nine story rereleased harpercollins love overboard second lineup presented almost original form ive done minor editing correct embarrassing blooper missed first time around changed title thought original title ivan take wife boring love overboard romantic tale handsome ship captain wary wench jersey city hundredyearold twomasted schooner entire town shoemaker there getting naked blueberry pie getting naked end okay wont tell end really good itll make feel happy took family road trip heck research book finally got maine worthwhile fell love boat people sailed enjoy,244,love overboard,janet evanovich,2005,http://books.google.com/books/content?id=5pClJ0BTE2gC&printsec=frontcover&img=1&zoom=1&source=gbs_api,fiction,2382,30,
dear reader previous life time plum wrote twelve short romance novel redhot screwball comedy every one nine story originally published loveswept line year 1988 1992 immediately went print could found used bookstore yard sale im excited tell nine story rereleased harpercollins back bedroom presented almost original form ive done minor editing correct embarrassing blooper missed first time around lived northern virginia wrote back bedroom child young spent lot time visiting washington dc museum wandering historic neighborhood one day strolling capitol hill came upon two townhouses captured imagination house totally different birthday cake house bran muffin house yet shared common wall wondered people lived inside house eventually house inspired back bedroom back bedroom story young woman soul birthday cake living bran muffin house nicelooking guy substance bran muffin living birthday cake share misadventure romantic moment misunderstanding ultimately turn wedding cake plum fan youll interested find first four romance feature elsie hawkins prototype grandma mazur janet evanovich,234,back to the bedroom,janet evanovich,2005,http://books.google.com/books/content?id=fcPjlwEACAAJ&printsec=frontcover&img=1&zoom=1&source=gbs_api,fiction,1856,27,
tall dark deliciously dangerous bos delightful daffy dog lady station wzzz offered take temporary job traffic reporter steve crow tried think reason turn daisy adam perhaps knew sharing close quarter car hour would give handsome program director room resist quirky charm hed always favored lowslung sportscars highheeled woman fell free spirit caught crook accident loved old people pet many job loving daisy turned steves life upside especially adopted bob huge dog masquerading couch potato daisy finally ready play keep,249,the rocky road to romance,janet evanovich,2004,http://books.google.com/books/content?id=b42OAHDzYqUC&printsec=frontcover&img=1&zoom=1&source=gbs_api,fiction,1325,25,
unique biography thomas jefferson leading journalist social critic christopher hitchens offer startlingly new provocative interpretation founding father situating jefferson within context america evolution tracing legacy past two hundred year hitchens brings character jefferson life man time also symbolic figure beyond conflicted power jefferson wrote declaration independence acted minister france yet yearned quieter career virginia legislature predicting slavery would shape future america development professed proponent emancipation elided issue declaration continued human property eloquent writer awkward public speaker reluctant candidate left indelible presidential legacy jefferson statesmanship enabled negotiate louisiana purchase france doubling size nation authorized lewis clark expedition opening american frontier exploration settlement hitchens also analyzes jefferson handling barbary war lesserknown chapter political career attempt end kidnapping bribery american barbary state subsequent war tripoli led building u navy fortification america reputation regarding national defense background sophisticated analysis large historical drama fledgling nation struggle independence formed crucible eighteenthcentury enlightenment shadow deformation struggle excess french revolution artful portrait formative figure turbulent era pose challenge anyone interested american history ambiguity human nature,188,thomas jefferson,christopher hitchens,2005,http://books.google.com/books/content?id=zV8P_3E1OCIC&printsec=frontcover&img=1&zoom=1&source=gbs_api,biography & autobiography,2828,21,
muhammad born 570 ce following sixty year built thriving spiritual community laying foundation religion changed course world history historical data life founder major faith yet story little known karen armstrong immaculately researched new biography muhammad enable reader understand true origin spirituality faith often misrepresented cruel intolerant inherently violent acclaimed authority religious spiritual issue armstrong offer balanced indepth portrait revealing man heart islam dismantling century misconception armstrong demonstrates muhammad lifea pivot point historyhas genuine relevance global crisis face today,256,muhammad,karen armstrong,2006,http://books.google.com/books/content?id=JUz3Z0iv_pgC&printsec=frontcover&img=1&zoom=1&source=gbs_api,biography & autobiography,2496,29,
many recent book historical jesus none explored latest biblical scholarship mean personal faith meeting jesus first time marcus borg address yearning want fully contemporary faith welcome rather oppresses critical intelligence openness best historical scholarship borg show rigorous examination historical finding lead new faith christ one critical time sustaining believing jesus mean believing doctrine borg writes rather mean give one heart one self deepest level living lord drawing journey naive unquestioning belief christ collegiate skepticism mature contemporary christian faith borg illustrates understanding historical jesus actually lead authentic christian lifeone rooted creed dogma life spiritual challenge compassion community straightforward accessible prose borg look major finding modern jesus scholarship perspective faith bringing alive many level jesus character spirit person teacher alternative wisdom social prophet movement founder also reexamines major story old testament vital authentic understanding jesus showing enriched understanding story uncover new truth new pathway faith questioning believer doubter reluctant unbeliever alike meeting jesus first time free understanding jesus life message popular misconception outline way sound contemporary faith ultimately jesus simply figure past figure present meeting jesusthe living one come u even nowwill like meeting jesus first time,160,meeting jesus again for the first time,marcus j. borg,1995,http://books.google.com/books/content?id=-_ieWUhA6V4C&printsec=frontcover&img=1&zoom=1&source=gbs_api,religion,2235,23,
one vital challenge facing thoughtful people today read bible faithfully without abandoning sense truth history reading bible first time provides muchneeded solution problem fully authentic yet contemporary understanding scripture many mistakenly believe choice fundamentalism simply rejecting bible something bring meaning life answering modern dilemma acclaimed author marcus borg reveals possible reconcile bible scientific critical way thinking deepest spiritual need leading contemporary yet grounded experience sacred text seminal book show read bible examinedin approach author call historicalmetaphorical borg explores scripture meant ancient community produced lived help u discover meaning story providing knowledge perspective make wisdom bible essential part modern life author argues conventional way seeing bible origin authority interpretation become unpersuasive million people time need fresh way encountering bible take text seriously literally even take seriously become borg trace personal spiritual journey describing reader moved unquestioning childhood belief biblical story powerful dynamic relationship bible sacred text brimming meaning guidance using experience example reveals modern crisis faith rooted misinterpretation sacred text historical record divine dictation open reader truer abundant perspective unique book invite everyonewhatever one religious backgroundto engage bible wrestle meaning explore mystery understand relevance borg show u encounter bible fresh way reject limit simple literalism open rich possibility life,321,reading the bible again for the first time,marcus j. borg,2002,http://books.google.com/books/content?id=pf0mlwEACAAJ&printsec=frontcover&img=1&zoom=1&source=gbs_api,religion,1707,30,
bestselling account martyrdom jim elliot four missionary hand auca indian ecuador new introduction author,272,shadow of the almighty,elisabeth elliot,1989,http://books.google.com/books/content?id=QQCG9mNU1eAC&printsec=frontcover&img=1&zoom=1&source=gbs_api,religion,2721,21,
acclaimed spiritual memoir author secret life bee amazed find idea unfold spiritual life feminine way surprised fact little terrified found middle feminist spiritual reawakening sue monk conventionally religious churchgoing woman traditional wife mother thriving career christian writer began question role woman culture family church jarring encounter sexism suburban drugstore monastery retreat ritual cave crete kidd take reader fear anger healing transformation awakening retaining meaningful connection deep song christianity open door traditional christian woman discover spirituality speaks directly provides inspiring wisdom struggle embrace full humanity,256,the dance of the dissident daughter,sue monk kidd,2002,http://books.google.com/books/content?id=0FV3JwAACAAJ&printsec=frontcover&img=1&zoom=1&source=gbs_api,religion,1606,29,
known throughout world intellect behind chronicle narnia twentieth century influential christian writer c lewis stirred million reader probing insight passionate argument provocative question god love life death gathered mass published work including screwtape letter mere christianity four love god dock well letter essay le familiar writing compendium contains cross section lewis finest work,176,c.s. lewis,c. s. lewis,1996,http://books.google.com/books/content?id=vtr4NDL8AP8C&printsec=frontcover&img=1&zoom=1&source=gbs_api,religion,1430,20,
humorous perceptive exchange two devil c lewis delf moral question good v evil temptation repentance grace wonderful tale reader emerges better understanding mean live faithful life,224,the screwtape letters,c. s. lewis,2001,http://books.google.com/books/content?id=v1kn7KYynzIC&printsec=frontcover&img=1&zoom=1&source=gbs_api,religion,2975,29,
forceful accessible discussion christian belief become one popular introduction christianity one popular lewis book uncovers common ground upon christian stand together,227,mere christianity,c. s. lewis,2001,http://books.google.com/books/content?id=LpHbXdKJaMwC&printsec=frontcover&img=1&zoom=1&source=gbs_api,religion,1506,21,
embraced life solitude hermitage thomas merton find faith tested beyond imagination visit hospital lead clandestine affair heart jolted comfortable routine merton forced reassess need love commitment celibacy monastic vocationthis astonishing volume trace merton struggle reconcile unexpected love sacred vow continuing grapple burning social issue day including racial conflict war vietnam arabisraeli conflict visiting corresponding highprofile friend like thich nhat hanh joan baez developing writing career revealing merton human chronicle ecstasy torment love learning love come full circle merton recommits completely deeply vocation even recognizes need love loneliness inner division struggle solitude problem solution perhaps perfect solution either 11 may 1967,382,learning to love,thomas merton,1998,http://books.google.com/books/content?id=U0nXswEACAAJ&printsec=frontcover&img=1&zoom=1&source=gbs_api,religion,1318,27,
man black country music legend quintessential american troubadour icon rugged individualism hell back telling tale never unforgettable autobiography johnny cash tell truth high low struggle hardwon triumph people shaped word cash set record straight dispelled myth looked unsparingly remarkable life joy boyhood dye arkansas superstardom nashville tennessee road cash life anything smooth cash writes thrill playing elvis comfort praying billy graham battle addiction devotion wife june gratitude life thought afterlife may bring friend lifetime including willie nelson roy orbison bob dylan kris kristofferson powerful memorable one classic song cash filled candor wit wisdom man truly walked line,310,cash,johnny cash,2003,http://books.google.com/books/content?id=yL6MRZfrWjkC&printsec=frontcover&img=1&zoom=1&source=gbs_api,biography & autobiography,1187,30,
first volume personal correspondence written classic author c lewis includes letter penned childhood world war army day education oxford atheist period early friendship j r r tolkien,1072,"the collected letters of c.s. lewis, volume 1",c. s. lewis,2004,http://books.google.com/books/content?id=eOxfuF6BQ0gC&printsec=frontcover&img=1&zoom=1&source=gbs_api,biography & autobiography,1384,29,
joe simpson climbing partner simon yates reached top 21000foot peak andes disaster struck simpson plunged vertical face ice ledge breaking leg hour followed darkness fell blizzard raged yates tried lower friend safety finally yates forced cut rope moment would pulled death next three day impossibly grueling ordeal men yates certain simpson dead returned base camp consumed grief guilt abandoning miraculously simpson survived fall crippled starving severely frostbitten trapped deep crevasse summoning vast reserve physical spiritual strength simpson crawled cliff canyon andes reaching base camp hour yates planned leave men overcame torment harrowing day epic tale fear suffering survival poignant testament unshakable courage friendship,218,touching the void,joe simpson,2004,http://books.google.com/books/content?id=Qg8DO-EqFzoC&printsec=frontcover&img=1&zoom=1&source=gbs_api,sports & recreation,2141,25,
